Title,Address,Type,Area,Price
 Bán khách sạn 8 tầng mặt tiền đường 7m5 khu Phạm Văn Đồng giá sụp hầm, Sơn Trà,Bán nhà mặt phố,210,
 Nhận Booking biệt thự Sun Neva Island của Sun Group - Nằm tại vị trí đắc địa nhất tại Đà Nẵng,"Phường Hòa Quý,  Ngũ Hành Sơn","Bán nhà biệt thự, liền kề",250,
 Bán 2 lô vệt sân bay Nước Mặn đường Võ Nguyên Giáp đối diện Crow ngang 12m,"Phường  Khuê Mỹ,  Ngũ Hành Sơn",Bán đất,313,39125000.0
" Biệt thự đảo biệt lập Sun Neva Island Đà Nẵng - Sở hữu lâu dài, đẳng cấp giới thượng lưu","Phường Hòa Quý,  Ngũ Hành Sơn","Bán nhà biệt thự, liền kề",300,
" Nhận booking BT Đảo kim cương độc nhất Đà Nẵng, pháp lý lâu dài, 4 mặt giáp sông","Phường Hòa Quý,  Ngũ Hành Sơn","Bán nhà biệt thự, liền kề",300,
 Bán đất đẹp đường Đông Hải 6 ngang 7m gần biển khu Đông Hải - Tân Trà,"Phường Hòa Hải,  Ngũ Hành Sơn",Bán đất,122.5,4500.0
" Biệt thự Đảo Đồng Nò tại Đà Nẵng, sở hữu lâu dài. Nằm tại vị trí đắc địa có 1 0 2 tại Việt Nam","Phường Hòa Quý,  Ngũ Hành Sơn","Bán nhà biệt thự, liền kề",300,
" Bán đất 3 mặt tiền Trần Văn Dư, Chế Lan Viên","Phường Mỹ An,  Ngũ Hành Sơn",Bán đất,704.1,
 Bán lô đất 2 mặt tiền đường Đỗ Bá. LH: 0964.003.499,"Phường Mỹ An,  Ngũ Hành Sơn",Bán đất,247,40014000.0
 Siêu phẩm biệt thự Sunneva Island Đà Nẵng - đảo Đồng Nò sở hữu lâu dài - nhận booking ngay,"Phường Hòa Quý,  Ngũ Hành Sơn","Bán nhà biệt thự, liền kề",250,
 Bán nhà 5.5 tầng đường Hàm Nghi đang cho thuê 45tr/tháng đoạn giữa đường Hùng Vương và bờ hồ, Hải Châu,Bán nhà mặt phố,103,26300.0
 Bán nhà 3 tầng đang kinh doanh tốt đường Trần Thánh Tông gần Khúc Hạo,"Phường Nại Hiên Đông,  Sơn Trà",Bán nhà mặt phố,100,8600.0
 Bán đất Hồ Nghinh gần Võ Văn Kiệt mặt tiền rộng 14m giá 18.5 tỷ,"Phường Phước Mỹ,  Sơn Trà",Bán đất,114,18500.0
 Bán nhà mặt tiền 3 tầng ngay Big C và chợ Cồn phù hợp vừa ở vừa kinh doanh,Hải Châu,Bán nhà mặt phố,65.8,6800.0
 Bán lô đất giá rẻ đường 15m Mai Đăng Chơn phù hợp kinh doanh buôn bán quận Ngũ Hành Sơn, Ngũ Hành Sơn,Bán đất,100,4800.0
 Bán lô đất kim cương mặt tiền Trần Bạch Đằng - Sát góc Đỗ Bá. Liên hệ: 0964.003.499,"Phường Mỹ An,  Ngũ Hành Sơn",Bán đất,382,87860000.0
" Bán đất đường Nguyễn Văn Linh, quận Hải Châu ngang 9m vị trí khẳng định thương hiệu","Phường Nam Dương,  Hải Châu",Bán đất,225,71000.0
 Giảm 2 tỷ bán nhanh nhà 3 tầng mặt tiền đường Nguyễn Hữu Thọ gần Trưng Nữ Vương,"Phường Hòa Thuận Tây,  Hải Châu",Bán nhà mặt phố,90,14650.0
" Cực hiếm chỉ 4,X tỷ/lô đất nền, sở hữu lâu dài tại Đà Nẵng, chiết khấu 8%, ngân hàng cho vay 70%.", Ngũ Hành Sơn,Bán đất nền dự án,100,4100000.0
" Bán lô đất và cặp đất đường An Thượng 4 - Phố Tây đi bộ Đà Nẵng, LH 0964003499","Phường Mỹ An,  Ngũ Hành Sơn",Bán đất,90,
 Bán đất đường Trần Cao Vân ngang gần 7m quận Thanh Khê gần Hà Huy Tập khu trung tâm,"Phường Xuân Hà,  Thanh Khê",Bán đất,113.5,12700.0
 Bán lô đất và cặp đất đường An Thượng 3 - LH: 0964.003.499,"Phường Mỹ An,  Ngũ Hành Sơn",Bán đất,90,
 Bán lô đất cực đẹp đường Trần Bạch Đằng gần Hoàng Kế Viêm. LH: 0964003499,"Phường Mỹ An,  Ngũ Hành Sơn",Bán đất,90,
 Bán lô đất đẹp mặt tiền đường Mỹ An 2 ngay cầu Trần Thị Lý gần Song Hàn,"Phường Mỹ An,  Ngũ Hành Sơn",Bán đất,90,
 Bán đất số 40 MT Hà Bổng DT: 232m2 ngang 10m - Gần Dương Đình Nghệ. Giá đầu tư,"Phường Phước Mỹ,  Sơn Trà",Bán đất,232,
 Bán nhà 3.5 tầng MT TRẦN CAO VÂN đoạn Ông Ích Khiêm giá rẻ,"Phường Tam Thuận,  Thanh Khê",Bán nhà riêng,116,13500.0
 MT BẮC ĐẨU - HẢI CHÂU tiện kinh doanh buôn bán,"Phường Thanh Bình,  Hải Châu",Bán nhà riêng,90,8000.0
 Bán lô đất đường Diên Hồng B1.60 Đại Lộ Trung Lương - Hòa Xuân - Đà Nẵng,"Phường Hòa Xuân,  Cẩm Lệ",Bán đất,100,5200.0
" Căn hộ Felicia mặt tiền biển Mỹ Khê ĐN chỉ 1,89 tỷ", Ngũ Hành Sơn,Bán căn hộ chung cư,32,1890.0
 Bán đất biển đường Trường Sa đối diện Resort ngay bãi tắm Non Nước,"Phường Hòa Hải,  Ngũ Hành Sơn",Bán đất,150,10500.0
" Bán lô góc đường Đặng Văn Bá, Hoà Quý, Ngũ Hành Sơn, Đà Nẵng","Phường Hòa Quý,  Ngũ Hành Sơn",Bán đất,163.3,5300.0
" Bán lô góc đường Hải Triều, Hoà Hải, Ngũ Hành Sơn","Phường Hòa Hải,  Ngũ Hành Sơn",Bán đất,116,4750.0
" Bán đất đường Mỹ An 7 hướng Đông m DT 100m2 giá chỉ 5ty650, LH 0942992361","Phường Mỹ An,  Ngũ Hành Sơn",Bán đất,100,5650.0
 2.1ha đất nhà vườn gần Bà Nà phong thủy đẹp,"Xã Hòa Ninh,  Hòa Vang",Bán đất,21813,10000.0
" Chính chủ, muốn bán lô đất Thôn An Ngãi Tây 2","Xã Hòa Sơn,  Hòa Vang",Bán đất,191,1520.0
 Bán nhà 3 tầng đường Trần Hưng Đạo đối diện CV sông Hàn,"Phường Nại Hiên Đông,  Sơn Trà",Bán nhà mặt phố,100,18000.0
" Bán cặp đất xây toà khách sạn đường Phạm Văn Đồng, Sơn Trà, Đà Nẵng","Phường  An Hải Bắc,  Sơn Trà",Bán đất,250,56000.0
" Bán căn hộ Mường Thanh 1PN full nội thất đẹp tầng cao, giá 1,75 tỷ","Phường Phước Mỹ,  Sơn Trà",Bán căn hộ chung cư,51,1750.0
 Bán đất Mỹ An 7 gần Sông Hàn Đà Nẵng,"Phường Mỹ An,  Ngũ Hành Sơn",Bán đất,100,5700.0
 Cần tiền bán lỗ căn góc Mường Thanh 2PN 2WC full nội thất giá bán 2 tỷ 350 triệu,"Phường Phước Mỹ,  Sơn Trà",Bán căn hộ chung cư,67,2350.0
" Chính chủ cần bán Tòa Căn Hộ kiệt 6m Phan Tứ, có dòng tiền 40tr/tháng, chỉ 9ty2","Phường Mỹ An,  Ngũ Hành Sơn",Bán nhà riêng,101,9200.0
" Bán lô 2 mặt tiền đường Ngô Quyền gần Cầu Rồng, Sơn Trà, Đà Nẵng","Phường Phước Mỹ,  Sơn Trà",Bán đất,98.5,15000.0
 Bán đất Bàu Gia Thượng gần công viên cạnh hồ sinh thái,"Phường Hòa Thọ Đông,  Cẩm Lệ",Bán đất,107.5,3350.0
" Bán căn góc 3PN chung cư HAGL tầng cao view sân bay, giá 2 tỷ 4xx, cập nhật tốt nhất thị trường","Phường Thạc Gián,  Thanh Khê",Bán căn hộ chung cư,117,2495.0
" Bán đất đường Trương Quốc Dung, Sơn Trà","Phường An Hải Đông,  Sơn Trà",Bán đất,122.5,4950.0
" Cần sang nhượng căn hộ 3PN view sông Hàn 130m2 Đà Nẵng Plaza, sổ hồng lâu dài nội thất đẹp vip","Phường Thạch Thang,  Hải Châu",Bán căn hộ chung cư,130,4500.0
" Bán cặp đất trung tâm Hải Châu, Đà Nẵng","Phường Thanh Bình,  Hải Châu",Bán đất,180,16500.0
" Bán đất đẹp gần chợ Cẩm Lệ, Khuê Trung, Đà Nẵng","Phường Khuê Trung,  Cẩm Lệ",Bán đất,70,3240.0
" Bán nhà 3 tầng kiệt ô tô quay đầu đường Lý Tự Trọng, nội thất cơ bản, giá 4 tỷ 8 (65m2 x 3 tầng)","Phường Thanh Bình,  Hải Châu",Bán nhà riêng,64.7,4800.0
 Bán đất Bùi Tá Hán gần Lê Văn Hiến giá tốt,"Phường  Khuê Mỹ,  Ngũ Hành Sơn",Bán đất nền dự án,100,8200.0
 Duy nhất căn góc 100m2 full NT view trực diện sông Hàn và cầu Rồng Indochina bán với giá 5 tỷ 4,"Phường Bình Hiên,  Hải Châu",Bán căn hộ chung cư,100,5400.0
 Biệt thự đảo kim cương - Đẳng cấp nhất Đà Nẵng - Pháp lý sổ đỏ lâu dài,"Phường Hòa Quý,  Ngũ Hành Sơn","Bán nhà biệt thự, liền kề",300,36900000.0
" Bán nhà mặt phố, trung tâm giá tốt cần bán nhanh. Phường Chính Gián, Thanh Khê, Tp Đà Nẵng","Phường Chính Gián,  Thanh Khê",Bán nhà mặt phố,75,7200.0
" Bán nhà mặt tiền đường Duy Tân, Hoà Thuận Tây, Hải Châu, Đà Nẵng","Phường Hòa Thuận Tây,  Hải Châu",Bán nhà mặt phố,132,19000.0
" Bán nhà mặt tiền Đỗ Bá, 88m2, Mỹ An, Ngũ Hành Sơn, Đà Nẵng","Phường Mỹ An,  Ngũ Hành Sơn",Bán nhà mặt phố,88,12600.0
" Bán đất đường Nhân Hoà 2, Cẩm Lệ, Đà Nẵng","Phường Hòa Xuân,  Cẩm Lệ",Bán đất,133,3750.0
" Cần bán căn biệt thự dự án Premier Village, Đà Nẵng trục đường biển Mỹ Khê. LH: 0932560868","Phường Mỹ An,  Ngũ Hành Sơn","Bán nhà biệt thự, liền kề",300,
 Bán đất chính chủ đường Trần Bạch Đằng nối dài,"Phường Phước Mỹ,  Sơn Trà",Bán đất,132,16700.0
" Bán lô đất trống MT đường Lê Lợi , DT 119m2 nở hậu 4,3 giá 15ty4 có thương lượng, 0942992361","Phường Thạch Thang,  Hải Châu",Bán nhà mặt phố,119,15400.0
" Bán căn hộ Hoàng Anh Gia Lai, 2 phòng ngủ, giá 2.19 tỷ","Phường Thạc Gián,  Thanh Khê",Bán căn hộ chung cư,94,2190.0
" Cần bán nhanh lô KĐT Dragon Đà Nẵng, đường 11m5 giá 2 tỷ 4. LH: 0931966270", Liên Chiểu,Bán đất nền dự án,100,2400.0
" Bán căn hộ Hoàng Anh Gia Lai, 2 phòng ngủ, giá 2.19 tỷ","Phường Thạc Gián,  Thanh Khê",Bán căn hộ chung cư,94,2190.0
" Cần bán nhanh lô KĐT Dragon Đà Nẵng, đường 11m5 giá 2 tỷ 4. LH: 0931966270", Liên Chiểu,Bán đất nền dự án,100,2400.0
" Thanh Khê - trung tâm - tiện ích bát ngát - gần trường chuẩn quốc gia - ô tô đỗ - 3 tầng - 2,85 tỷ","Phường An Khê,  Thanh Khê",Bán nhà riêng,50,2850.0
 Chủ nhà cần bán căn hộ Monarchy 2PN - Đã có sổ,"Phường An Hải Tây,  Sơn Trà",Bán căn hộ chung cư,68,2600.0
" Cần bán nhanh trong tuần lô 2 mặt tiền đường Quán Khái 3 - 4 đối diện công viên , giá rẻ","Phường Hòa Hải,  Ngũ Hành Sơn",Bán đất,141,5000.0
" Cần bán căn hộ view biển Mỹ Khê, Đà Nẵng có sổ hồng, sở hữu lâu dài. LH 0931966270","Phường Phước Mỹ,  Sơn Trà",Bán căn hộ chung cư,58.66,3800.0
 Chính chủ cần bán nhà đường Huỳnh Lý,"Phường Thuận Phước,  Hải Châu",Bán nhà riêng,91.5,10100.0
" Căn hộ HAGL, tầng cao mát mẻ, dành cho người thích chinh phục độ cao, ngắm trọn view đẹp Đà Nẵng","Phường Thạc Gián,  Thanh Khê",Bán căn hộ chung cư,94,2050.0
" Căn Hộ Cao Cấp 5* The 6Nature Sơn Trà Đà Nẵng...2PN,3PN..Giá Đẹp ! 3tỷ5", Sơn Trà,Bán căn hộ chung cư,60,3500.0
 Bán 2 lô đất MT Lê Đức Thọ - Q. Sơn Trà 1512m2,"Phường Nại Hiên Đông,  Sơn Trà",Bán đất,1512,
" Bán lô góc TĐC Đông Hải, Hoà Hải, Ngũ Hành Sơn, Đà Nẵng, DT: 197,3m2","Phường Hòa Hải,  Ngũ Hành Sơn",Bán đất,197.3,7000.0
" Bán đất MT đường Vùng Trung 16 khu đô thị Phú Mỹ An, Quận Ngũ Hành Sơn","Phường Hòa Hải,  Ngũ Hành Sơn",Bán đất nền dự án,100,3600.0
" Chủ cần tiền đẩy nhanh lô đất đẹp thuộc KĐT Phú Mỹ An, Ngũ Hành Sơn, Đà Nẵng","Phường Hòa Hải,  Ngũ Hành Sơn",Bán đất nền dự án,100,3650.0
 Chính chủ cần tiền bán nhanh lô biệt thự đường Trương Minh Giảng thuộc KĐT Phú Mỹ An,"Phường Hòa Hải,  Ngũ Hành Sơn",Bán đất nền dự án,150,4550.0
" Bán căn villa 3,5 tầng gồm 4 căn hộ cho thuê kiệt Chế Lan Viên, phường Mỹ An, Ngũ Hành Sơn","Phường Mỹ An,  Ngũ Hành Sơn",Bán nhà riêng,347.6,17500.0
" Chủ cần tiền bán nhanh lô đất Vũ Văn Cẩn 150m2 thuộc khu đô thị Phú Mỹ An, Đà Nẵng Pearl","Phường Hòa Hải,  Ngũ Hành Sơn",Bán đất nền dự án,150,6000.0
" Chính chủ gửi bán lô đất đường Vũ Văn Cẩn, khu đô thị Phú Mỹ An, Đà Nẵng","Phường Hòa Hải,  Ngũ Hành Sơn",Bán đất nền dự án,106.3,3880.0
" Bán đất đường Bà Huyện Thanh Quan, Đà Nẵng, LH 0932560868 Richtahouse", Ngũ Hành Sơn,Bán đất,394,
 Cần bán đất Vùng Trung 3 khu đô thị Phú Mỹ An - Ngũ Hành Sơn - Đà Nẵng,"Phường Hòa Hải,  Ngũ Hành Sơn",Bán đất nền dự án,150,4950.0
" Bán nhà 3,5 tầng đường Nguyễn Xiển sát đường Minh Mạng Ngũ Hành Sơn","Phường Hòa Hải,  Ngũ Hành Sơn",Bán nhà riêng,107,7800.0
 Bán lô đất đường Nguyễn Phạm Tuân - Ngũ Hành Sơn,"Phường Hòa Hải,  Ngũ Hành Sơn",Bán đất,140,5200.0
" Bán lô đất 1000m2 ở lâu dài đường Trường Sa, Đà Nẵng đối diện resort 5 sao. LH: 0932560868","Phường Hòa Hải,  Ngũ Hành Sơn",Bán đất,1000,
" Bán lô đất đường Quán Khái 4, khu phố chợ Hoà Hải, Ngũ Hành Sơn, Đà Nẵng","Phường Hòa Hải,  Ngũ Hành Sơn",Bán đất,91.8,3050.0
 Bán nhanh lô đất trục đường Nguyễn Phan Chánh đấu lưng Trần Đại Nghĩa,"Phường Hòa Hải,  Ngũ Hành Sơn",Bán đất nền dự án,150,5000.0
" Bán nhanh lô đất trục đường Nguyễn Quý Anh đấu lưng Song Hào, Sát Sông","Phường Hòa Hải,  Ngũ Hành Sơn",Bán đất nền dự án,150,5400.0
 Đất nền KĐT Nam Hòa Xuân - Sổ đỏ bàn giao ngay - Xây dựng tự do - Chỉ từ 40tr/m2,"Phường Hòa Quý,  Ngũ Hành Sơn",Bán đất nền dự án,100,4000000.0
 Chính chủ bán lô đất 319m2 2 mặt tiền đường 7.5m - giá ưu đãi - LH: 0932560868,"Phường An Hải Tây,  Sơn Trà",Bán đất,319,
" Bán đất 2 mặt tiền đường Võ Nguyên Giáp đoạn công viên Cá Voi, Đà Nẵng. LH: 0932560868","Phường Phước Mỹ,  Sơn Trà",Bán đất,3207,
 Mở bán siêu phẩm biệt thự ven sông số lượng hữu hạn đẳng cấp nhất Đà Nẵng. HTLS 0% 2 năm,"Phường Hòa Quý,  Ngũ Hành Sơn","Bán nhà biệt thự, liền kề",200,
" Bán đất biệt thự Euro Village 2, Đà Nẵng. LH: 0932560868","Phường Hòa Xuân,  Cẩm Lệ",Bán đất nền dự án,300,
 Cần bán đất khu An Thượng ven biển Đà Nẵng. LH: 0932560868, Ngũ Hành Sơn,Bán đất,300,
 Cần bán đất đường Đỗ Bá cách biển 200m khu An Thượng ven biển Đà Nẵng. LH: 0932560868,"Phường Mỹ An,  Ngũ Hành Sơn",Bán đất,296,
 Bán biệt thự Ocean Villas 5 sao ven biển Đà Nẵng. LH: 0932560868,"Phường Hòa Hải,  Ngũ Hành Sơn","Bán nhà biệt thự, liền kề",530,
" Bán đất đường Võ Nguyên Giáp view biển, Q. Sơn Trà, Đà Nẵng. LH: 0932560868","Phường Mân Thái,  Sơn Trà",Bán đất,2700,
 Bán đất nền đẹp nhất Đà Nẵng - Sun Group - Sổ đỏ lâu dài - Xây dựng tự do,"Phường Hòa Quý,  Ngũ Hành Sơn",Bán đất nền dự án,100,4500.0
 Nhà phố 4 tầng ngay hầm chui qua Sông Hàn. Liền kề tổ hợp TTTM dịch vụ khách sạn của TĐ Sungroup,"Phường Nại Hiên Đông,  Sơn Trà","Bán nhà biệt thự, liền kề",144,
" Bán nhà 2,5 tầng đầu kiệt ô tô 4m Lê Đình Lý Q. Thanh Khê giá tốt","Phường Vĩnh Trung,  Thanh Khê",Bán nhà riêng,49,3650.0
 Bán đất biệt thự ven sông khu đô thị Hoà Quý,"Phường Hòa Quý,  Ngũ Hành Sơn",Bán đất nền dự án,148,4590.0
 Bán nhà ở gần chợ Hòa Khánh - Liên Chiểu. Dân Cư Buôn bán đông đúc,"Phường Hòa Khánh Bắc,  Liên Chiểu",Bán nhà riêng,72,1300.0
" Chính chủ gởi bán đất đường 7,5m Trần Kim Xuyến, Hoà Xuân, Đà Nẵng. DT: 100m2 - Hướng Đông Bắc","Phường Hòa Xuân,  Cẩm Lệ",Bán đất,100,3650.0
" Chính chủ gởi bán đất đường 7,5m Trần Kim Xuyến, Hoà Xuân, Đà Nẵng. DT: 100m2 - Hướng Đông Bắc","Phường Hòa Xuân,  Cẩm Lệ",Bán đất,100,3650.0
" Chính chủ bán 2 lô đất đường 7.5m Kha Vạn Cân, Hoà Châu, Đà Nẵng. DT 100m2, Tây Nam","Xã Hòa Châu,  Hòa Vang",Bán đất,100,2750.0
" Chủ bán nhà 2 tầng 2 mê đường 7,5m Nguyễn Kim, Hoà Xuân - Hướng Bắc, DT 100m2, giá tốt nhất","Phường Hòa Xuân,  Cẩm Lệ",Bán nhà riêng,100,5190.0
" Bán nhà 3 tầng mặt tiền đường Thanh Long, Phường Thanh Bình, Hải Châu, Đà Nẵng","Phường Thanh Bình,  Hải Châu",Bán nhà mặt phố,56,6500.0
 Chủ tôi cần bán căn nhà 3 tầng đường 2/9 đối diện khu vui chơi giải trí Helio,"Phường Hòa Cường Nam,  Hải Châu",Bán nhà mặt phố,112.5,16800.0
" Chính chủ gửi bán 3 lô đất đường 7.5m Phan Khôi, Hoà Xuân, Đà Nẵng, DT 100m2, lô đẹp, LH 0932555342","Phường Hòa Xuân,  Cẩm Lệ",Bán đất,100,3000.0
" Bán gấp nhà ngay đầu kiệt ô tô 8m đường Núi Thành, Hòa Thuận Đông, Hải Châu, Đà Nẵng","Phường  Hòa Thuận Đông,  Hải Châu",Bán nhà riêng,92.5,8000.0
" Chủ bán đất lô góc đường 10,5m Nguyễn Hồng Ánh, Nam Cẩm Lệ, Đà Nẵng. DT 107m2, Hướng Tây - Bắc","Xã Hòa Châu,  Hòa Vang",Bán đất,102.6,4850.0
 Chính chủ bán đất khu Dragon City Park, Liên Chiểu,Bán đất nền dự án,137,3562000.0
 Bán Lô FPT SẬP HẦM ngang 8m view kênh sinh thái,"Phường Hòa Hải,  Ngũ Hành Sơn",Bán đất nền dự án,150,4200.0
" Bán nhà 2 mặt tiền đường Thanh Hải, Thanh Bình, Hải Châu, Đà Nẵng","Phường Thanh Bình,  Hải Châu",Bán nhà riêng,85,9000.0
" Chính chủ bán đất đường 10.5m Văn Tiến Dũng, Hoà Xuân - Hướng Tây view công viên: 0932555342","Phường Hòa Xuân,  Cẩm Lệ",Bán đất,100,5100.0
" Bán nhà 3 tầng mặt tiền đường Thanh Long, phường Thanh Bình, Hải Châu, Đà Nẵng","Phường Thanh Bình,  Hải Châu",Bán nhà mặt phố,90,8500.0
 Lô đất vàng mặt Trần Hưng Đạo - Hơn 300m2 chỉ có 4x tỷ,"Phường  An Hải Bắc,  Sơn Trà",Bán đất,306.6,47000.0
" Bán gấp nhà 3 tầng full nội thất đường Lê Anh Xuân, Hòa Cường Nam, Hải Châu, Đà Nẵng","Phường Hòa Cường Nam,  Hải Châu",Bán nhà mặt phố,110,7500.0
" Nhà phố Oriana Đà Nẵng - Nhà phố 2 mặt đường ngay sát sông Hàn, kề 4 tòa thương mại của Sungroup?","Phường Nại Hiên Đông,  Sơn Trà","Bán nhà biệt thự, liền kề",144,
" Chính chủ gởi bán đất đường 15m Mai Chí Thọ, Hoà Xuân, Đà Nẵng. Hướng Tây Bắc, DT 114m2 sạch đẹp","Phường Hòa Xuân,  Cẩm Lệ",Bán đất,114,6000.0
" Bán nhà 3 tầng 2 mặt kiệt ô tô đường Hà Huy Tập, P. Xuân Hà, Thanh Khê, Đà Nẵng","Phường Xuân Hà,  Thanh Khê",Bán nhà riêng,63,4800.0
 Căn hộ cao cấp gần chợ Hoà Khánh - Sổ hồng vĩnh viễn chỉ 650tr trả trước sở hữu ngay,"Phường Hòa Hiệp Bắc,  Liên Chiểu",Bán căn hộ chung cư,60,
" Siêu phẩm lô góc mặt tiền đường 10m5 Đinh Gia Trinh & Hà Duy Phiên, Hoà Xuân.","Phường Hòa Xuân,  Cẩm Lệ",Bán đất,438,21000.0
" Bán gấp nhà ngay đầu kiệt ô tô 8m đường Núi Thành, Hòa Thuận Đông, Hải Châu, Đà Nẵng","Phường  Hòa Thuận Đông,  Hải Châu",Bán nhà riêng,92.5,8000.0
" Chính chủ bán đất đường Nguyễn Kim, Hoà Xuân, Đà Nẵng - Hướng Bắc, DT: 100m2,","Phường Hòa Xuân,  Cẩm Lệ",Bán đất,100,3550.0
" Bán nhà 4 tầng 2 mặt tiền đường Phạm Văn Nghị, Phường Thạc Gián, Thanh Khê, Đà Nẵng","Phường Thạc Gián,  Thanh Khê",Bán nhà mặt phố,60,9500.0
" Căn hộ The Sang ngay trung tâm TP Đà Nẵng. Giá giai đoạn 1 từ CĐT, miễn lãi suất 0% cho KH vay vốn","Phường  Khuê Mỹ,  Ngũ Hành Sơn",Bán căn hộ chung cư,82.5,
" Bán nhà đẹp 5 tầng đường Đinh Tiên Hoàng, Thanh Bình, Hải Châu, Đà Nẵng","Phường Thanh Bình,  Hải Châu",Bán nhà riêng,62,8300.0
" Chính chủ gởi bán đất đường 7,5m Nguyễn Kim, Hoà Xuân, Đà Nẵng - Hương Nam - sạch đẹp .dt :100m2","Phường Hòa Xuân,  Cẩm Lệ",Bán đất,100,3570.0
 Cập nhật hàng Hoà Xuân ngày 20/06/2022, Cẩm Lệ,Bán đất nền dự án,100,3630.0
 Sở hữu không gian sống đẳng cấp cùng biệt thự 3 mặt tiền sông. Cách biển 500m Regal One River,"Phường Hòa Hải,  Ngũ Hành Sơn","Bán nhà biệt thự, liền kề",300,
" Chuyển nơi ở,tôi bán nhanh căn nhà tâm huyết 2 tầng chỉ 2,x tỷ","Phường Chính Gián,  Thanh Khê",Bán nhà mặt phố,104.8,2750.0
 Căn hộ The Sang Đà Nẵng thu hút khách hàng đầu tư với chính sách hỗ trợ 0% lãi suất trong 24 tháng?,"Phường  Khuê Mỹ,  Ngũ Hành Sơn",Bán căn hộ chung cư,77.4,
 Đất biển đầu tư mặt tiền Lê Văn Quý - 434m2 (25x17m). Giá chỉ 77 tỷ,"Phường  An Hải Bắc,  Sơn Trà",Bán đất,434,77000.0
 Căn hộ Sơn Trà - 2PN giá rẻ Full nội thất,"Phường An Hải Đông,  Sơn Trà",Bán căn hộ chung cư,45,1100.0
" Ra mắt KĐT đẳng cấp tại đảo kim cương đầu tiên và duy nhất của tập đoàn Sun Group, SL hữu hạn","Phường Hòa Quý,  Ngũ Hành Sơn","Bán nhà biệt thự, liền kề",200,
" Bán gấp nhà 3 tầng 2 mặt tiền đường Thanh Sơn, Phường Thanh Bình, Hải Châu","Phường Thanh Bình,  Hải Châu",Bán nhà mặt phố,90,10000.0
" Cần tiền bán nhanh lô đất đường Loseby, Sơn Trà, Đà Nẵng","Phường  An Hải Bắc,  Sơn Trà",Bán đất,95,
" Bán nhà mới xây hoàn thiện đầy đủ hồ sơ thiết kế, full nội thất cao cấp","Phường Hòa Khánh Bắc,  Liên Chiểu","Bán nhà biệt thự, liền kề",70,2950.0
" Sunshine Heritage Đà Nẵng - tổ hợp Hotel & Resort 6* đầu tiên tại Đà Nẵng, mở bán giai đoạn 1","Phường Hòa Hải,  Ngũ Hành Sơn","Bán nhà biệt thự, liền kề",,
" Chủ cần bán GẤP trong tuần, nhà MT Tân Thái 2, Gần chợ Chiều, biển Mân Thái, Quận Sơn Trà.","Phường Mân Thái,  Sơn Trà",Bán nhà riêng,91,5850.0
" Bán nhà mới xây hoàn thiện đầy đủ hồ sơ thiết kế, full nội thất cao cấp","Phường Hòa Khánh Bắc,  Liên Chiểu",Bán nhà riêng,70,2950.0
" Bán căn 1 phòng ngủ, tầng đẹp, hướng mát, sổ lâu dài, LH: 0345538613","Phường Hòa Hiệp Nam,  Liên Chiểu",Bán căn hộ chung cư,45,
" Kẹt tiền cần bán gấp căn nhà 2 tầng MT đường Nguyễn Đăng Đạo, giá 6 tỷ cho 96m2","Phường Hòa Thuận Tây,  Hải Châu",Bán nhà mặt phố,96,6000.0
" Bán biệt thự biển Đà Nẵng, Ocean Villas 5 sao. LH: 0942 776 978","Phường Hòa Hải,  Ngũ Hành Sơn","Bán nhà biệt thự, liền kề",764,33500.0
" Bán nhà đẹp mặt tiền Nguyễn Công Hoan, Đà Nẵng. LH: 0942 776 978", Cẩm Lệ,Bán nhà mặt phố,75,3850.0
 mặt tiền đường 17m5 diện tích 150m2 hướng Đông Nam, Ngũ Hành Sơn,Bán đất nền dự án,150,2300.0
" Chính chủ cần thanh lý đất nền Đà Nẵng hơn 2 tỷ, vị trí trung tâm","Phường Hòa Khánh Bắc,  Liên Chiểu",Bán đất nền dự án,100,
 Bán lô đất đường Đinh Đức Thiện,"Phường Hòa Minh,  Liên Chiểu",Bán đất,90,3750.0
" Cơ hội sở hữu ngay căn hộ sinh ra tiền lời hàng năm cho gia chủ view biển Mỹ, Felicia Ocean View", Ngũ Hành Sơn,Bán condotel,56,
" Cần bán lô đất khu đô thị Golden Hills, giá 2 tỷ 1. LH: 0942 776 978","Phường Hòa Hiệp Nam,  Liên Chiểu",Bán đất nền dự án,100,2100.0
 Biệt thự view sông Hàn - Sunneva Island - đẳng cấp giới thượng lưu Đà Nẵng,"Phường Hòa Quý,  Ngũ Hành Sơn","Bán nhà biệt thự, liền kề",500,60000000.0
" Cần bán đất nền KĐT Dragon Đà Nẵng, thanh toán theo tiến độ. LH: 0942 776 978", Liên Chiểu,Bán đất nền dự án,100,2400.0
" Bán shophouse 2 mặt tiền A1 Nguyễn Sinh Sắc, sát biển Nguyễn Tất Thành giá đầu tư - Full nội thất","Phường Hòa Minh,  Liên Chiểu","Bán nhà biệt thự, liền kề",280,26600.0
" Dự án BĐS đẳng cấp và an toàn nhất trên thị trường, khẳng định vị thế độc tôn tại Đà Nẵng","Phường Hòa Quý,  Ngũ Hành Sơn","Bán nhà biệt thự, liền kề",300,
 Bán nhà 2 tầng Nam Nguyễn Tất Thành.,"Phường Hòa Hiệp Nam,  Liên Chiểu",Bán nhà riêng,100,3300.0
" Sunneva Island, biệt thự đảo đầu tiên và duy nhất tại Đà Nẵng","Phường Hòa Quý,  Ngũ Hành Sơn","Bán nhà biệt thự, liền kề",200,
" Chính chủ bán lô đất MT Bà Huyện Thanh Quan, P. Mỹ An DT 214,5m2 liên hệ trực tiếp để chính chủ","Phường Mỹ An,  Ngũ Hành Sơn",Bán đất,214.5,10725000.0
" Vị trí biệt lập, thiết kế độc nhất, tiện ích vượt trội - duy nhất Sunneva Island","Phường Hòa Quý,  Ngũ Hành Sơn","Bán nhà biệt thự, liền kề",200,
