Title,Address,Type,Area,Price
 Bán biệt thự One River - TP Đà Nẵng - 2 mặt tiền sông - Sát Biển - Sổ đỏ vĩnh viễn - LH 0932446632,"Phường Hòa Hải,  Ngũ Hành Sơn","Bán nhà biệt thự, liền kề",300,
" Vỡ nợ ngân hàng, bán gấp lô đất gần đường Nguyễn Tất Thành - Chỉ 3,8 tỷ - DT 156m2 (7m8 x 20.8m)","Phường Hòa Hiệp Nam,  Liên Chiểu",Bán đất,156,3800.0
 Bán shophouse 2 mặt tiền đường Kinh Dương Vương. Thích hợp đầu tư - kinh doanh,"Phường Hòa Minh,  Liên Chiểu","Bán shophouse, nhà phố thương mại",155,13800.0
" Bán 20.000m2 ngay cạnh khu du lịch tắm khoáng nóng Phước Nhơn, Hòa Vang 0962138263","Xã Hòa Khương,  Huyện Hòa Vang",Bán đất,20000,
 Bán nhanh 1 căn duy nhất view trực diện sông Cổ Cò. Giá rẻ hơn chủ đầu tư LH: 0902 478 818,"Phường Hòa Hải,  Ngũ Hành Sơn","Bán nhà biệt thự, liền kề",300,
 Bán nhanh 1 căn biệt thự ven sông giá ngoại giao ngay tại Đà Nẵng,"Phường Hòa Hải,  Ngũ Hành Sơn","Bán nhà biệt thự, liền kề",300,26000.0
" Chỉ với 2x tỷ, sở hữu ngay 1 căn biệt thự duy nhất ven sông tựa núi tại Đà Nẵng - LH: 0902 478 818","Phường Hòa Hải,  Ngũ Hành Sơn","Bán nhà biệt thự, liền kề",300,
" Bán shophouse giá đẹp ngay tại trung tâm TP Đà Nẵng, LH: 0902478818","Phường Hòa Cường Nam,  Hải Châu","Bán shophouse, nhà phố thương mại",120,18000.0
" Bán biệt thự triệu đô ven sông đầu tiên tại Đà Nẵng, 2 mặt tiền","Phường Hòa Hải,  Ngũ Hành Sơn","Bán nhà biệt thự, liền kề",300,26000.0
" Bán đất đường VŨ ĐÌNH LIÊN, 1 lô duy nhất sát đường lớn Võ Chí Công,","Phường Hòa Xuân,  Cẩm Lệ",Bán đất,100,4000.0
 Nhanh tay booking biệt thự đảo kim cương Sunneva Island Đà Nẵng của Sungroup,"Phường Hòa Quý,  Ngũ Hành Sơn","Bán nhà biệt thự, liền kề",250,45000000.0
 CẦN BÁN CĂN NHÀ 3 TẦNG MẶT TIỀN ĐƯỜNG BÙI CÔNG TRỪNG ĐẸP NHẤT KHU HÒA XUÂN - Có PHÒNG NGỦ DƯỚI,"Phường Hòa Xuân,  Cẩm Lệ",Bán đất,100,5950.0
" Cần bán nhanh 144m2 sạch đẹp, giá chỉ 3 tỷ 8, liên hệ 0934999708","Phường Hòa Hải,  Ngũ Hành Sơn",Bán đất nền dự án,144,3800.0
" Bán đấu giá BĐS tại khu công nghệ cao Hòa Hiệp Bắc, Liên Chiểu, Đà Nẵng","Phường Hòa Hiệp Bắc,  Liên Chiểu",Bán đất nền dự án,22399,46075.0
" Chính chủ cần bán nhanh lô đất 102m2, giá chỉ 3,0x tỷ, trục thông sát trường, sổ hồng trao tay","Phường Hòa Hải,  Ngũ Hành Sơn",Bán đất nền dự án,102,3090.0
" Cần bán gấp lô đất đường Phùng Hưng sát biển Nguyễn Tất Thành,P Hoà Minh,Q Liên Chiểu Đà Nẵng",P Hoà Minh,Bán đất,125,6500.0
" Bán nhà 2 mặt tiền Phước Mỹ 1, Quận Sơn Trà, 220m2 x 3 tầng, giá 20,1 tỷ: 0399981818","Phường Phước Mỹ,  Sơn Trà",Bán nhà mặt phố,220,20100.0
" Bán đất khu Tân Trà - Đà Nẵng, bên cạnh resort Sheraton đường Trường Sa, ngang 7.5m, ra biển 100m","Phường Hòa Hải,  Ngũ Hành Sơn",Bán đất nền dự án,138.7,6090.0
" Bán khách sạn 11 tầng, giá 50 tỷ, đường An Đồn 5, P. An Hải Bắc, Sơn Trà, Tp. Đà Nẵng. 0399981818","Phường  An Hải Bắc,  Sơn Trà",Bán nhà mặt phố,198,50000.0
" Biệt thự đẹp khu đô thị công nghệ FPT Đà Nẵng, 216m2, 445m, 605m, giá chỉ 25tr/m2. LH: 0934 999 708","Phường Hòa Hải,  Ngũ Hành Sơn",Bán đất nền dự án,216,5500.0
" Bán nhà 2 mặt tiền Ngô Quyền, Sơn Trà, Đà Nẵng, 168m2","Phường Thọ Quang,  Sơn Trà",Bán nhà mặt phố,168,23000.0
" Bán nhà 2 mặt tiền Lê Tấn Trung, Sơn Trà, Đà Nẵng, 359m2, 26,8 tỷ. LH: 0399981818","Phường Thọ Quang,  Sơn Trà",Bán nhà mặt phố,359,26800.0
 Bán nhà Cổ Mân Mai 1 - Hoà Xuân - Cẩm Lệ,"Phường Hòa Xuân,  Cẩm Lệ",Bán nhà mặt phố,95,2970.0
" Bán khách sạn 7 tầng đường Lê Mạnh Trinh, 298m2 giá 55 tỷ. LH: 0399981818","Phường Phước Mỹ,  Sơn Trà",Bán nhà mặt phố,298,55000.0
" 5 suất ngoại giao vip nhất dự án Sunneva Island giá rẻ hơn CĐT 25%, LH ngay để nhận booking căn đẹp","Phường Hòa Quý,  Ngũ Hành Sơn","Bán nhà biệt thự, liền kề",250,28000.0
 Bán lô đường 11.5m Đoàn Khuê - Nam Việt Á - Ngũ Hành Sơn,"Phường  Khuê Mỹ,  Ngũ Hành Sơn",Bán đất nền dự án,100,5100.0
 Siêu phẩm biệt thự đảo đáng sống nhất Việt Nam - Sunneva Island Đà Nẵng tôn vinh vị thế chủ nhân,"Phường Hòa Quý,  Ngũ Hành Sơn","Bán nhà biệt thự, liền kề",240,30000.0
 Sunneva Island đẳng cấp thượng lưu và có nên đầu tư BĐS Đà Nẵng thời điểm hiện tại,"Phường Hòa Quý,  Ngũ Hành Sơn","Bán nhà biệt thự, liền kề",300,28000.0
 Điều kiện cần (10 tỷ) có ngay villa Sunneva Island đẳng cấp nhất Tp Đà Nẵng - Sở hữu lâu dài,"Phường Hòa Quý,  Ngũ Hành Sơn","Bán nhà biệt thự, liền kề",250,32000.0
 Bán lô đường 10.5m Mẹ Thứ - Sát Thanh Hoá - Hoà Xuân,"Phường Hòa Xuân,  Cẩm Lệ",Bán đất,115,5200.0
 Bán đất đường Nguyễn Hữu Thọ - Khuê Trung - Cẩm Lệ,"Phường Khuê Trung,  Cẩm Lệ",Bán đất,250,31000.0
 Bán lô Trần Hữu Duẩn - view công viên Hoà Xuân - Ngang 7.5m,"Phường Hòa Xuân,  Cẩm Lệ",Bán đất,169.5,4400.0
 Vị trí xứng danh giới thượng lưu - Sunneva Island mảnh ghép đẳng cấp còn thiếu của Tp. Đà Nẵng,"Phường Hòa Quý,  Ngũ Hành Sơn","Bán nhà biệt thự, liền kề",300,28000.0
 Bán lô Đống Công Tường và Huỳnh Tịnh Của - Nam Cẩm Lệ,"Phường Hòa Xuân,  Cẩm Lệ",Bán đất,117.5,2720.0
" Bán đất khu Đảo 1, Đảo 2, Đảo Vip, Gần Cầu Hòa Xuân (Khu Hòa Xuân, Cẩm Lệ, Đà Nẵng)","Phường Hòa Xuân,  Cẩm Lệ",Bán đất,100,
" Độc nhất 1 căn shophouse khối đế chung cư Ori garden Đà Nẵng chỉ 1,8 tỷ. Rất đẹp để kinh doanh","Phường Hòa Hiệp Nam,  Liên Chiểu",Bán loại bất động sản khác,57.7,1800.0
" Chỉ 945 triệu. căn hộ chung cư Ori Garden hỗ trợ vay ngân hàng, siêu rẻ và đẹp","Phường Hòa Hiệp Nam,  Liên Chiểu",Bán căn hộ chung cư,45,
" Sốc! Còn 2 căn 1PN chung cư Ori Garden Đà Nẵng, giá chỉ 945 triệu (có thể thay đổi công năng)","Phường Hòa Hiệp Nam,  Liên Chiểu",Bán căn hộ chung cư,45,1000.0
" Bán shop kinh doanh vừa ở tầng 1 chung cư Ori Garden Đà Nẵng, sẵn 5000 dân, chỉ từ 1,77 tỷ","Phường Hòa Hiệp Nam,  Liên Chiểu",Bán loại bất động sản khác,55,1770.0
" 2 căn duy nhất shophouse khối đế chung cư ori Garden Đà Nẵng chỉ từ 1,8 tỷ, đối diện villa","Phường Hòa Hiệp Nam,  Liên Chiểu","Bán shophouse, nhà phố thương mại",55,1800.0
" Shophouse khối đế The Ori Garden Đà Nẵng 1,7 tỷ, có đáng đầu tư trước thời điểm lạm phát?","Phường Hòa Hiệp Nam,  Liên Chiểu","Bán shophouse, nhà phố thương mại",47,1650.0
" 2 căn Shophouse Ori Garden Đà Nẵng trước hồ bơi, chỉ 1,7 tỷ ( sổ đổ lâu dài), đóng tiến độ","Phường Hòa Hiệp Nam,  Liên Chiểu",Bán căn hộ chung cư,67,2300.0
" Chính chủ bán căn hộ Đà Nẵng 2PN full nội thất, giá 1,25 tỷ cho vay 500 triệu. LH 0905703086","Phường Hòa Hiệp Nam,  Liên Chiểu",Bán căn hộ chung cư,56,1250.0
 Bán lô góc 2 MT đường 10.5m Phan Thao vs Đặng Nhơn - Hoà Xuân,"Phường Hòa Xuân,  Cẩm Lệ",Bán đất,178.4,8000.0
 Bán lô MT Lý Thánh Tông - Sơn Trà gần bãi biển Phạm Văn Đồng,"Phường  An Hải Bắc,  Sơn Trà",Bán đất,96.5,10900.0
" Shophouse khối đế chung cư Ori Garden Đà Nẵng giá ngang 1 lô đất huyện, chỉ từ 1,8 tỷ. 0905703086", Quận Liên Chiểu,Bán căn hộ chung cư,60,1800.0
 Bán lô MT đường Mai Đăng Chơn - Hoà Quý - Ngũ Hành Sơn,"Phường Hòa Quý,  Ngũ Hành Sơn",Bán đất,100,4800.0
 Bán nhà 3 tầng 3 mê MT đường Hàn Thuyên - Hoà Cường Bắc - Hải Châu,"Phường Hòa Cường Bắc,  Hải Châu",Bán nhà mặt phố,100,9500.0
" Duy nhất 1 căn khối đế chung cư Ori Garden, nội khu, diện tích lớn nhất, sẵn 5000 dân, vừa ở vừa KD","Phường Hòa Hiệp Nam,  Liên Chiểu",Bán căn hộ chung cư,78.4,2500.0
" CC bán đất mặt tiền An Thượng, cách Đỗ Bá 30m, cách biển 1km, diện tích 62m2. Giá 5 tỷ","Phường Mỹ An,  Ngũ Hành Sơn",Bán đất,62,5000.0
" Cần bán vài căn Villa hiện đại, full nội thất cao cấp khu biển Đà Nẵng", Sơn Trà,Bán nhà mặt phố,150,10000.0
 Bán nhà MT số 26x Dương Đình Nghệ. Đà Nẵng,"Phường Phước Mỹ,  Sơn Trà",Bán nhà mặt phố,87.5,11200.0
" Bán đất Phùng Hưng, sát Nguyễn Tất Thành, Dt 125m2 giá 6.5 tỷ","Phường Thanh Khê Tây,  Thanh Khê",Bán đất,125,6500.0
" Cần bán lô góc 2 mặt tiền thuộc khu đô thị Hoà Quý, Đà Nẵng B2.101 DT 170m2. Giá 7.9 tỷ","Phường Hòa Quý,  Ngũ Hành Sơn",Bán đất nền dự án,170.4,7900.0
 Biệt thự Sunneva Island mở bán giai đoạn 1 đẳng cấp giới thượng lưu,"Phường Hòa Quý,  Ngũ Hành Sơn","Bán nhà biệt thự, liền kề",300,
 Sở hữu căn hộ mặt tiền biển nơi du lịch sầm uất nhất Việt Nam giá chỉ 1tỷ 9 /1căn, Ngũ Hành Sơn,Bán căn hộ chung cư,42,1900.0
" Bán nhanh lô đất nền điện âm Nam Hoà Xuân, Hoà Quý, Đà Nẵng. B2.26 DT 122m2, giá 4,9 tỷ","Phường Hòa Quý,  Ngũ Hành Sơn",Bán đất nền dự án,122.5,4900.0
" Cần tiền bán gấp lô đất đường 20m5, dự án Dragon City Đà Nẵng, giá rẻ, trục chính thông 0932446632", Liên Chiểu,Bán đất nền dự án,150,
" Bán nhà Kiệt 353 tổ 46 phường Hòa Thọ Đông, Cẩm Lệ, TP Đà Nẵng","Phường Hòa Thọ Đông,  Cẩm Lệ",Bán nhà riêng,72,2850.0
" Shopphouse chung cư Ori Garden Liên Chiểu, Đà Nẵng, cơ hội từ 1,793 - 2.5 Tỷ", Liên Chiểu,"Bán shophouse, nhà phố thương mại",55.7,1793.0
" Bán GẤP Lô đất 125m2 MT Đường Nguyễn Lương Bằng, Gần cổng KCN Hoà Khánh","Phường Hòa Khánh Bắc,  Liên Chiểu",Bán đất,125,5875.0
" Cần bán gấp lô đất Trần Văn Đán, Ngũ Hành Sơn, Đà Nẵng","Phường Hòa Hải,  Ngũ Hành Sơn",Bán đất,100,4600.0
 Mở bán tòa căn hộ cao cấp giá rẻ Đà Nẵng chỉ từ 1.55 tỷ/căn 2 phòng ngủ,"Phường Hòa Hải,  Ngũ Hành Sơn",Bán căn hộ chung cư,56,1550.0
" Chính chủ cần bán nhà phường Hòa Thọ Đông, Quận Cẩm Lệ, Đà Nẵng","Phường Hòa Thọ Đông,  Cẩm Lệ",Bán nhà riêng,126.1,4200.0
" Chính chủ bán nhà riêng chính chủ diện tích 101,8m2 mặt tiền Hải Sơn","Phường Thanh Bình,  Hải Châu",Bán nhà mặt phố,101.8,7635000.0
 Cần bán căn hộ mini gần công viên 29/3 Thanh Khê - LH: 0366528515,"Phường Thạc Gián,  Thanh Khê",Bán căn hộ chung cư,46,1170.0
" Thông Nguyễn Sinh Sắc dự án Kim Long khu E3. Giá đầu tư, trục thông đẹp nhất dự án","Phường Hòa Minh,  Liên Chiểu",Bán đất nền dự án,100,4400.0
 Biệt thự Đảo Ngọc mặt kênh sinh thái view sông - cách biển 700m - TT dàn trải - sổ lâu dài giá CĐT,"Phường Hòa Hải,  Ngũ Hành Sơn","Bán nhà biệt thự, liền kề",345,
" Đất nền Đà Nẵng Dragon Park City k bắt buộc xây dựng giá chỉ 2 tỷ/lô , chiết khấu cao0972219588", Liên Chiểu,Bán đất nền dự án,100,
" Nhà phố hai mặt tiền view sông Hàn, trung tâm Đà Nẵng, gần dự án Sun Olalani","Phường Nại Hiên Đông,  Sơn Trà",Bán nhà mặt phố,144,11200.0
" Bán 3 căn biệt thự view công viên, ngay sông Hàn, trung tâm Đà Nẵng, giá ưu đãi","Phường Nại Hiên Đông,  Sơn Trà","Bán nhà biệt thự, liền kề",288,22500.0
" Siêu phẩm, gia chủ cần tiền bán rẻ lại căn nhà 4 tầng siêu đẹp, ngay sông Hàn, trung tâm Đà Nẵng","Phường Hòa Cường Nam,  Hải Châu",Bán nhà mặt phố,120,17058.0
" Bán nhà 3,5 tầng hai mặt tiền trung tâm Đà Nẵng, giá 9,5 tỷ","Phường Nại Hiên Đông,  Sơn Trà",Bán nhà mặt phố,144,9500.0
" Bán nhà 2 mặt tiền view sông Hàn, trung tâm Đà Nẵng, đường 20m","Phường Nại Hiên Đông,  Sơn Trà",Bán nhà mặt phố,144,
 Bán nhà 2 tầng 2 mê chuồng cu đường Cồn Dầu 2 _ Hòa Xuân giá tốt,"Phường Hòa Xuân,  Cẩm Lệ",Bán nhà mặt phố,100,3850.0
 BÁN ĐẤT CHÍNH CHỦ KHU HOÀ XUÂN MỞ RỘNG - GẦN CẦU HOÀ XUÂN - CẨM LỆ - TP.ĐÀ NẴNG:,"Phường Hòa Xuân,  Cẩm Lệ",Bán đất,121,
 Mua nhanh kẻo lỡ giá chưa đến 2 tỷ ngay trung tâm đi ra biển nguyễn tất thành 5p,"Phường Tam Thuận,  Thanh Khê",Bán nhà riêng,35,1850.0
" Sở hữu căn hộ biển cao cấp The Sang chỉ với 1,3 tỷ được tặng ngay gói quà tặng trị giá 300 triệu","Phường  Khuê Mỹ,  Ngũ Hành Sơn",Bán căn hộ chung cư,82,3813.0
 Nóng bỏng tay - chỉ từ 2 tỷ sở hữu ngay đất nền ven biển trung tâm TP Đà Nẵng 0928095888, Liên Chiểu,Bán đất nền dự án,85,1900.0
 Đất nền DA B - Ocean bên cạnh UBND Quận Liên Chiểu 2 trục đường Nguyễn Sinh Sắc và Hoàng Thị Loan,"Phường Hòa Minh,  Liên Chiểu",Bán đất nền dự án,93,3900.0
" Bán nhà C4 mặt tiền Tôn Thất Thiệp, Ngũ Hành Sơn, Đà Nẵng","Phường Mỹ An,  Ngũ Hành Sơn",Bán nhà mặt phố,65,4950.0
" Suất 3 căn ưu tiên giá CĐT gần KĐT Nam Hòa Xuân, sở hữu lâu dài ,vốn từ 9 tỷ, miễn gốc lãi 24 tháng", Ngũ Hành Sơn,"Bán shophouse, nhà phố thương mại",146,21608000.0
 Bán Đất - Nhà Xưởng 278m2 MT Đường 33m Võ Chí Công- Đoạn Gần Cầu Nguyễn Tri Phương,"Phường Hòa Xuân,  Cẩm Lệ",Bán đất,278,22000.0
" Bán đất MT đường Võ Nguyên Giáp, kế bên A la carte hotel, Q. Sơn Trà, DT: 741m2","Phường Phước Mỹ,  Sơn Trà",Bán đất,741,240000.0
" Mở bán phân khu mới Dragon Seaphoni. Giá chỉ 2 tỷ 2, năm sau có sổ", Liên Chiểu,Bán đất nền dự án,100,2200.0
" Bán nhanh lô 100m2 Dragon Smart City đường 7m5 tại Quận Liên Chiểu, Đà Nẵng. LH: 0942 689 467","Phường Hòa Hiệp Nam,  Liên Chiểu",Bán đất nền dự án,100,
" Bán đất mặt tiền đường 2 tháng 9, P. Hoà Cường, Quận Hải Châu. DT: 1313m2","Phường Hòa Cường Bắc,  Hải Châu",Bán đất,1313,180000.0
" Bán khách sạn 4 sao góc 2 mặt tiền đường Võ Nguyên Giáp, P. Phước Mỹ, Q. Sơn Trà","Phường Phước Mỹ,  Sơn Trà",Bán nhà mặt phố,738,435000.0
" Bán Villa cực đẹp 3 mặt tiền đường 2/9, P. Hòa Cường Bắc, Q. Hải Châu. DT: 2.543m2","Phường Hòa Cường Bắc,  Hải Châu",Bán nhà mặt phố,2543,315000.0
" Bán khách sạn 4 sao mặt tiền đường Võ Nguyên Giáp, P. Phước Mỹ, Q. Sơn Trà","Phường Phước Mỹ,  Sơn Trà",Bán nhà mặt phố,600,450000.0
" Bán gấp lô đất tặng nhà cấp 4 cũ kiệt ô tô Trần Phú, Hải Châu sau lưng nhà mặt tiền","Phường  Hải Châu I,  Hải Châu",Bán đất,39,4100.0
" Bán khách sạn 4 sao góc 2 mặt tiền đường Võ Nguyên Giáp, Q. Sơn Trà. DT: 600m2","Phường Phước Mỹ,  Sơn Trà",Bán nhà mặt phố,600,435000.0
" Bán khách sạn góc 2 mặt tiền đường Võ Nguyên Giáp, Q. Sơn Trà. DT: 740m2","Phường Phước Mỹ,  Sơn Trà",Bán nhà mặt phố,740,435000.0
" Chỉ với 1,3 tỷ (20%) sở hữu ngay căn hộ cao cấp 5 sao mặt tiền sông Hàn, ngay trung tâm thành phố","Phường Bình Thuận,  Hải Châu",Bán căn hộ chung cư,68,6500.0
 Bán Đất đường HOÀI THANH gần ngay LÊ VĂN HƯU giá tốt - P Mỹ An - Ngũ Hành Sơn - Đà Nẵng.,"Phường  Khuê Mỹ,  Ngũ Hành Sơn",Bán đất,88,5200.0
 Booking quyền ưu tiên mua căn hộ The Filmore Đà Nẵng 100 triệu/suất không mua hoàn lại tiền,"Phường Bình Thuận,  Hải Châu",Bán căn hộ chung cư,71,7810000.0
 Bán lô đất đẹp mặt tiền đường Mỹ An 2 giá rẻ ngay Cầu Trần Thị Lý Phường Mỹ An Đà Nẵng,"Phường Mỹ An,  Ngũ Hành Sơn",Bán đất,90,5650.0
" Bán khách sạn 4 sao góc 2 mặt tiền đường Võ Nguyên Giáp, Sơn Trà. DT: 740m2","Phường Phước Mỹ,  Sơn Trà",Bán nhà mặt phố,740,435000.0
" Bán khách sạn 4 sao đường Võ Nguyên Giáp, P. Phước Mỹ, Q. Sơn Trà. DT: 600m2","Phường Phước Mỹ,  Sơn Trà",Bán nhà mặt phố,600,280000.0
" Bán khách sạn 4 sao mặt tiền đường Võ Nguyên Giáp, P. Phước Mỹ, Q.Sơn Trà đối diện nhà hàng 4U","Phường Phước Mỹ,  Sơn Trà",Bán nhà mặt phố,600,435000.0
" Bán nhà gác lửng K572 Ông Ích Khiêm, Nam Dương, Hải Châu","Phường Nam Dương,  Hải Châu",Bán nhà riêng,54.2,2300.0
" Bán nhà mặt tiền chợ An Hải Bắc, đường Nguyễn Chí Diễu, An Hải Bắc, Sơn Trà, Đà Nẵng","Phường  An Hải Bắc,  Sơn Trà",Bán nhà mặt phố,125,11700.0
 Đảo Kim Cương Sunneva Island món quà từ mặt trời,"Phường Hòa Quý,  Ngũ Hành Sơn","Bán nhà biệt thự, liền kề",300,32000.0
" Bán lô đất góc 2 mặt tiền Trần Bạch Đằng - Đỗ Bá, Phường Mỹ An, Q. Ngũ Hành Sơn. DT: 931m2","Phường Mỹ An,  Ngũ Hành Sơn",Bán đất,931,270000.0
" Bán nhà mặt tiền đường 2 Tháng 9, P. Hoà Cường, Quận Hải Châu","Phường Hòa Cường Bắc,  Hải Châu",Bán nhà mặt phố,1313,158000.0
 Bán lô góc đẹp nhất dự án Phú Mỹ An diện tích 324m2 giá 13 tỷ,"Phường Hòa Hải,  Ngũ Hành Sơn",Bán đất nền dự án,324,13000.0
 Cần bán đất biệt thự Trung Lương 9 - Khu đảo VIP - DT: 250 m2,"Phường Hòa Xuân,  Cẩm Lệ",Bán đất,250,11000.0
 CẦN TIỀN BÁN GẤP LÔ ĐẤT LÊ QUANG ĐẠO 82.4m2. NGANG 4.5m2 GẦN KHU PHỐ TÂY AN THƯỢNG,"Phường Mỹ An,  Ngũ Hành Sơn",Bán đất,82.4,12000.0
 Nhà 2 tầng 3pn full nội thất ngay công an quận Thanh Khê - ô tô đậu 24/7 gần nhà,"Phường Hòa Khê,  Thanh Khê",Bán nhà riêng,52,2650.0
 Chủ cần bán nhanh lô đất nền Nam Hoà Xuân.b2.97 sạch đẹp giá hạ nhiệt 3.27 tỷ, Ngũ Hành Sơn,Bán đất nền dự án,105,3270.0
 Nhà 2 mê 3PN full nội thất sát chợ hoa - Thanh Khê,"Phường An Khê,  Thanh Khê",Bán nhà riêng,60,3250.0
 Đất MT Phú Xuân 2 kẹp công viên 10m khu vip - Gần biển - Xây căn hộ là sự lựa chọn lý tưởng,"Phường Hòa Minh,  Liên Chiểu",Bán đất,100,4200.0
 Bán lô đường 10.5m lề 5m Đô Đốc Lân - Hoà Xuân - Cẩm Lệ đối diện trường C3 Nguyễn Văn Thoại,"Phường Hòa Xuân,  Cẩm Lệ",Bán đất,100,4250.0
 Bán nhà MT Cồn Dầu 1 - Hoà Xuân - Cẩm Lệ,"Phường Hòa Xuân,  Cẩm Lệ",Bán nhà mặt phố,100,3780.0
 Bán lô đường 7.5m lề 3m Đoàn Hữu Trưng - Hoà An - Cẩm Lệ giá tốt,"Phường Hòa An,  Cẩm Lệ",Bán đất,117,4070.0000000000005
 Bán nhà 3 tầng đường 10.5m Nguyễn Đức Trung - nhà 3 mặt tiền đang kinh doanh - chính chủ bán,"Phường Thanh Khê Đông,  Thanh Khê",Bán nhà mặt phố,133,20000.0
" Bán lô đường 7.5m lề 4m Nguyễn Kim - Hoà Xuân, giá tốt nhất thị trường","Phường Hòa Xuân,  Cẩm Lệ",Bán đất,100,3520.0
 Bán lô đường 15m lề 5m MT Phạm Hùng - Hoà Phước,"Xã Hòa Phước,  Hòa Vang",Bán đất,107.5,6200.0
 Đất đường Cồn Dầu 18 - Ven sông sinh thái Hòa Xuân,"Phường Hòa Xuân,  Cẩm Lệ",Bán đất nền dự án,100,4250.0
" Nhà 2 mặt đường Nguyễn Thị Minh Khai, trung tâm thành phố, Hải Châu, Đà Nẵng","Phường Thạch Thang,  Hải Châu",Bán nhà mặt phố,675.8,118264999.99999999
" Cặp đất biệt thự phố tây Bùi Viện Đà Nẵng, đối lưng Thăng Long ven sông Hàn","Phường Hòa Cường Nam,  Hải Châu",Bán đất,496,30752000.0
 Khu E Kim Long - Nguyễn Sinh Sắc gần biển. Chỉ 4 tỷ/ lô,"Phường Hòa Minh,  Liên Chiểu",Bán đất nền dự án,90,4000.0
" Lô góc đường 10,5m Trương Định - Hướng Đông view biển. Giá tốt nhất Sơn Trà, Đà Nẵng","Phường Mân Thái,  Sơn Trà",Bán đất,105,12075000.0
" Bán toà căn hộ 4 tầng - mặt tiền Khu An Thượng - Đà Nẵng. Xây 4 tầng, 7 phòng cho thuê 24tr - 6tỷ7", Ngũ Hành Sơn,Bán nhà mặt phố,65,6700.0
" Cần bán nhanh nhà 2 tầng diện tích lớn, kiệt 3m đường Đống Đa giá rẻ","Phường Thạch Thang,  Hải Châu",Bán nhà riêng,62,3500.0
 Hoà Ninh diện tích 20000m2 có 400m2 đất ở đường hai tô tránh nhau. Cách đường vành đai 300m,"Xã Hòa Ninh,  Hòa Vang","Bán trang trại, khu nghỉ dưỡng",20000,
" Hàng kín giá tốt bán nhà hai tầng cách bãi tắm Mỹ Khê 200m. DT: 215m2 ngang 7,8m","Phường Mỹ An,  Ngũ Hành Sơn",Bán nhà mặt phố,215,18060000.0
" Sốc lô đất sạch đẹp mặt tiền đường 30,5m giá 46,7 tr/m2, ngang 7,5. Vị trí đẹp nhất khu Phú Mỹ An","Phường Hòa Hải,  Ngũ Hành Sơn",Bán đất,150,7000.0
 Bán nhà 3 tầng đường Hoàng Hiệp - Hoà Xuân,"Phường Hòa Xuân,  Cẩm Lệ",Bán nhà mặt phố,100,5400.0
 Bán nhà 2 tầng đường Khương Hữu Dụng - Hoà Xuân,"Phường Hòa Xuân,  Cẩm Lệ",Bán nhà mặt phố,100,4400.0
" Sốc sốc sốc lô đất diện tích lớn hai mặt tiền Phan Tứ, giá sơ sơ sinh chưa qua đầu tư. Sát biển","Phường Mỹ An,  Ngũ Hành Sơn",Bán đất,520,50000.0
" Chính chủ cần bán gấp khách sạn mini 7 tầng, cách biển 400m","Phường An Hải Đông,  Sơn Trà",Bán nhà riêng,74,15000.0
 Bán 3 lô liền kề kho Nguyễn Công Hoan - Sau lưng bến xe Đà Nẵng,"Phường Hòa An,  Cẩm Lệ",Bán đất,545,18000.0
 Bán nhà 3 tầng 2 mặt kiệt 90 Nguyễn Văn Linh - P. Nam Dương - Q. Hải Châu - ĐN,"Phường Nam Dương,  Hải Châu",Bán nhà riêng,73,4850.0
" Bán lô góc 2MT TĐC Đà Sơn - Hoà Khánh Nam - Liên Chiểu, giá tốt","Phường Hòa Khánh Nam,  Liên Chiểu",Bán đất,204.9,5500.0
 Bán lô đường 7.5m lề 3m Đỗ Thúc Tịnh - Khuê Trung - Cẩm Lệ,"Phường Khuê Trung,  Cẩm Lệ",Bán đất,103,5000.0
 Bán 2 lô liền kề đường Nguyễn Hữu Thọ - Khuê Trung - Cẩm Lệ,"Phường Khuê Trung,  Cẩm Lệ",Bán đất,250,31000.0
 Bán lô 2 mặt tiền Thanh Lương 11 và Thanh Lương 12 - Hoà Xuân - Cẩm Lệ,"Phường Hòa Xuân,  Cẩm Lệ",Bán đất nền dự án,128.9,5600.0
" Chính chủ bán nhà view biển Mâu Thái, sau đường Vĩ Nguyên Giáp, DT 105m2, MT 5m. LH: 0845636888","Phường Mân Thái,  Sơn Trà",Bán nhà riêng,105,8000.0
" Căn hộ 2PN The Ori Garden giá tốt nhất 1.150tỷ, view hồ bơi nội khu. Diện tích 53m2","Phường Hòa Hiệp Nam,  Liên Chiểu",Bán căn hộ chung cư,53.4,1150.0
 Bán lô MT Văn Tiến Dũng - Hoà Xuân - đoạn đầu đường giá tốt,"Phường Hòa Xuân,  Cẩm Lệ",Bán đất,100,5200.0
 Bán lô góc 2MT đường Ngô Mây và Hoàng Đạo Thành - Hoà Xuân - Cẩm Lệ,"Phường Hòa Xuân,  Cẩm Lệ",Bán đất,127,4750.0
" Chính chủ xuất ngoại gấp nên bán rẻ nhà giá đẹp như mơ, hiếm có, nội thất đầy đủ, siêu sang","Phường Thanh Khê Đông,  Thanh Khê",Bán nhà riêng,51,2700.0
 Bán nhà 3 tầng 3 mê MT Vũ Quỳnh - Thanh Khê,"Phường Thanh Khê Tây,  Thanh Khê",Bán nhà mặt phố,75,5200.0
" Bán đất đường Phạm Văn Đồng, ngay gần biển: 0962138263","Phường An Hải Đông,  Sơn Trà",Bán đất,125,27000.0
" Đất chính chủ mặt tiền đường Xô Viết Nghệ Tĩnh, Hải Châu, Đà Nẵng","Phường Khuê Trung,  Cẩm Lệ",Bán đất,150,16500.0
 Bán nhà 3 tầng đường Trung Lương 15 - Đảo Vip - Hoà Xuân - Cẩm Lệ,"Phường Hòa Xuân,  Cẩm Lệ",Bán nhà mặt phố,100,6800.0
 Cần thu hồi vốn bán nhanh căn shophouse tại phố đi bộ đẳng cấp nhất trung tâm Đà Nẵng,"Phường Hòa Cường Nam,  Hải Châu","Bán nhà biệt thự, liền kề",120,18500.0
 Bán lô đường Lê Kim Lăng - Hoà Thọ Đông - Cẩm Lệ lề 12m,"Phường Hòa Thọ Đông,  Cẩm Lệ",Bán đất,116,6150.0
 Chính chủ cần bán biệt thự nghỉ dưỡng Đà Nẵng One River sở hữu lâu dài giá tốt nhất,"Phường Hòa Hải,  Ngũ Hành Sơn","Bán nhà biệt thự, liền kề",300,23000.0
 Bán đất đường Lê Quảng Chí - Hoà Xuân - Cẩm Lệ - TP Đà Nẵng,"Phường Hòa Xuân,  Cẩm Lệ",Bán đất,100,6700.0
