Title,Address,Type,Area,Price
 Bán gấp khách sạn phố đi bộ Vip An Thượng 1 khu phố Tây biển Mỹ Khê,"Phường Mỹ An,  Ngũ Hành Sơn",Bán nhà mặt phố,80,23000.0
 Bán gấp khách sạn mini trung tâm phố Hàn đường 10.5m cách biển Mỹ Khê 400m,"Phường Phước Mỹ,  Sơn Trà",Bán nhà mặt phố,75.5,14000.0
 Chỉ từ 10 tỷ sở hữu ngay biệt thự đảo 4 mặt giáp sông trung tâm thành phố Đà Nẵng SunNeva Island,"Phường Hòa Quý,  Ngũ Hành Sơn","Bán nhà biệt thự, liền kề",300,
 Bán khách sạn Đà Nẵng gần bãi tắm Mỹ Khê giá tốt và pháp lý chuẩn làm việc chính chủ,"Phường Mỹ An,  Ngũ Hành Sơn",Bán nhà mặt phố,162,42000.0
 Bán nhà phố liền kề mặt tiền đường Trương Quốc Dụng dự án Mariacom Plex, Sơn Trà,"Bán nhà biệt thự, liền kề",144,11200.0
 Cần bán gấp khách sạn mặt biển Võ Nguyên Giáp giá chỉ 36 tỷ,"Phường Mỹ An,  Ngũ Hành Sơn",Bán nhà mặt phố,140,36000.0
" Chính chủ cần bán gấp khách sạn biển Đà Nẵng giá tốt, pháp lý chuẩn từ VRM","Phường Phước Mỹ,  Sơn Trà",Bán nhà mặt phố,100,22500.0
" Cần bán gấp đất mặt tiền Trần Bạch Đằng sát biển Mỹ Khê, giá chỉ 135 tr/m2","Phường Phước Mỹ,  Sơn Trà",Bán đất,311,41985000.0
 Cần bán cặp Dương Đình Nghệ 10x17.5m = 175m2. Giá 25 tỷ,"Phường  An Hải Bắc,  Sơn Trà",Bán đất,175,25000.0
 Nhà 3 tầng Hải Châu - đối diện trường Đông Á,"Phường Hòa Cường Bắc,  Hải Châu",Bán nhà mặt phố,70,7200.0
 Bán nhà đẹp 3 tầng khu Nam Việt Á,"Phường  Khuê Mỹ,  Ngũ Hành Sơn",Bán nhà mặt phố,90,5700.0
 Bán shophouse 4 tầng phố đi bộ dự án Regal Pavillon,"Phường Hòa Cường Nam,  Hải Châu","Bán shophouse, nhà phố thương mại",120,
 Mở bán căn hộ cao cấp ven biển Mỹ Khê Đà Nẵng - Giá gốc từ chủ đầu tư,"Phường  Khuê Mỹ,  Ngũ Hành Sơn",Bán căn hộ chung cư,82.6,4600.0
 Bán nhà phố liền kề mặt tiền đường Hoá Sơn 10 dự án Regal Pavillon Đà Nẵng, Hải Châu,"Bán nhà biệt thự, liền kề",120,17000.0
 HOT! NÓNG!HOT...CHỦ ĐẦU TƯ SUN GROUP MỞ BÁN ĐẤT NỀN TẠI ĐÀ NẴNG!!!,"Phường Hòa Quý,  Ngũ Hành Sơn",Bán đất nền dự án,100,5000000.0
" ĐẤT NỀN ĐÃ CÓ SỔ, KHÔNG BẮT XÂY TP ĐÀ NẴNG 15P RA BIỂN GIÁ 4.3 TỶ/100M2 - CĐT SUNGROUP CK 8% CÓ VAY","Phường Hòa Xuân,  Cẩm Lệ",Bán đất nền dự án,100,4300.0
 Không người quản lý cần sang nhượng lại KS hiện đại chuẩn 4 sao An Đồn 6,"Phường  An Hải Bắc,  Sơn Trà",Bán nhà mặt phố,210,
" Khu đô thị sang trọng, đẳng cấp, là mảnh ghép còn thiếu trong quy hoạch đô thị bài bản của Đà Nẵng","Phường Hòa Quý,  Ngũ Hành Sơn","Bán nhà biệt thự, liền kề",100,
 Chuẩn bị ra mắt khu đô thị đẳng cấp đầu tiên tại Đà Nẵng: Sunneva Island,"Phường Hòa Quý,  Ngũ Hành Sơn","Bán nhà biệt thự, liền kề",100,
" Biệt thự ven sông duy nhất tại TP Đà Nẵng, đã có sổ - View trực diện sông - Lưng tựa núi", Quận Ngũ Hành Sơn,"Bán nhà biệt thự, liền kề",300,
" Đất rẻ đẹp gần biển xây nhà ở, căn hộ, homestay khu vực quận Sơn Trà","Phường An Hải Đông,  Sơn Trà",Bán đất,73.5,4650.0
 Bán lô biệt thự đảo xanh giá 65 tỷ,"Phường Hòa Cường Bắc,  Hải Châu",Bán đất,380,65000.0
" Bán lô biệt thự siêu đẹp 250m2 Golden Hills giá tốt 3,950 tỷ hướng Đông Bắc rẻ hơn lô ống", Liên Chiểu,Bán đất,250,
 Cần bán nhà MT Ngô Quyền giá sập hầm,"Phường Thọ Quang,  Sơn Trà",Bán nhà mặt phố,101,7900.0
" Bán nhanh lô đất đẹp khu E Kim Long 90m2, giá 4,05 tỷ","Phường Hòa Minh,  Liên Chiểu",Bán đất nền dự án,90,4050.0
 Mình cần bán nhanh biệt thự đẹp trung tâm giá siêu tốt,"Phường Khuê Trung,  Cẩm Lệ","Bán nhà biệt thự, liền kề",204,16500.0
 Cần bán nhanh lô đất quá rẻ khu E Kim Long,"Phường Hòa Minh,  Liên Chiểu",Bán đất nền dự án,90,4000.0
 Bán cặp đất đường Lê Quang Đạo khu phố tây An Thượng,"Phường Mỹ An,  Ngũ Hành Sơn",Bán đất,170,28000.0
 Bán tòa căn hộ giá sập hầm đường Lê Lộ,"Phường Mỹ An,  Ngũ Hành Sơn",Bán nhà riêng,81,11500.0
" Cần bán lô đất đẹp đường Bàu Mạc 21, giá tốt 3,05 tỷ","Phường Hòa Khánh Bắc,  Liên Chiểu",Bán đất,100,3050.0
" Bán toà căn hộ kiệt ô tô Nguyễn Văn Thoại 5 tầng 81m2, giá 7,8 tỷ TL","Phường Phước Mỹ,  Sơn Trà",Bán nhà riêng,81,7800.0
" Cần bán nhà phố cạnh Lotte, trong dãy shophouse Hala Jade. Rất phù hợp vừa ở vừa kinh doanh","Phường Hòa Cường Bắc,  Hải Châu","Bán nhà biệt thự, liền kề",150,12500.0
 Có việc cần bán gấp 3 dãy nhà trọ mặt tiền đường trong Làng Đại Học Đà Nẵng. Đang cho thuê ổn định,"Phường Hòa Hải,  Ngũ Hành Sơn",Bán nhà mặt phố,250,8000.0
 Bán gấp nhà MT Lê Duẩn - Đà Nẵng. Đang kinh doanh thu nhập rất tốt,"Phường  Hải Châu I,  Hải Châu",Bán nhà mặt phố,224,65000.0
" Cần bán nhanh căn Azura tầng 32 giá 5,7 tỷ TL thiện chí","Phường  An Hải Bắc,  Sơn Trà",Bán căn hộ chung cư,133,5700.0
 Cần tiền thu xếp việc gia đình bán gấp 3 dãy nhà trọ trong làng ĐH Đà Nẵng,"Phường Hòa Hải,  Ngũ Hành Sơn",Bán nhà mặt phố,168,
" Bán căn hộ Hiyori tầng 25 view đẹp full nội thất Hướng Nam mát mẻ giá tốt nhất thị trường 3,7tỷ TL","Phường An Hải Đông,  Sơn Trà",Bán căn hộ chung cư,63,3700.0
 Cần bán nhanh căn hộ Hiyori tầng 26 giá rất tốt từ 3.35 tỷ - 3.7 tỷ,"Phường An Hải Đông,  Sơn Trà",Bán căn hộ chung cư,63,
" Bán căn hộ Hiyori tầng cao thoáng mát view đẹp giá từ 3,35 tỷ","Phường An Hải Đông,  Sơn Trà",Bán căn hộ chung cư,66.8,3350.0
" Chung cư Hải Châu, ở ngay, sổ đỏ, 45m2 - 2PN, chỉ hơn 900tr. Tặng nội thất - Ở ngay","Phường Hòa Cường Nam,  Hải Châu",Bán căn hộ chung cư,45,
" Bán đất nền Nam Hòa Xuân, Đà Nẵng","Phường Hòa Quý,  Ngũ Hành Sơn",Bán đất nền dự án,100,3400.0
 Bán lô đất Phước Trường 15 - 80m2 đối diện công viên Hồ Nghinh - Sơn Trà. Cách biển 500m,"Phường Phước Mỹ,  Sơn Trà",Bán đất,80,8800.0
" Bán lô góc 2 mặt tiền Lê Quang Đạo, DT 304m2 - 50 tỷ. LH: 0982765866","Phường Mỹ An,  Ngũ Hành Sơn",Bán đất,304,50000.0
" Hot! Bán lô đất nền 100m đường Lê Quảng Chí(20,5m) sổ đỏ Đông Nam giá chỉ 4.1 tỷ-10p tới sân bay","Phường Hòa Xuân,  Cẩm Lệ",Bán đất nền dự án,100,4100.0
" Chính chủ cần bán nhà 3 tầng Diệp Minh Châu sang trọng, sau lưng trường Chú Ếch Con Hòa Xuân","Phường Hòa Xuân,  Cẩm Lệ",Bán nhà mặt phố,100,5200.0
" Bán lô đất mặt đường Lê Quảng Chí, Đông Nam đã có sổ KĐT Hòa Xuân - Đà Nẵng - SunGroup: 0928508689","Phường Hòa Xuân,  Cẩm Lệ",Bán đất nền dự án,100,4800.0
 Bán cặp đất đường Trần Hưng Đạo Ven Sông Đà Nẵng.,"Phường An Hải Tây,  Sơn Trà",Bán đất,210,29500.0
 Lô góc gần 1000m2 số 49 Lý Thường Kiệt góc với đường Nguyễn Chí Thanh đối diện căn hộ F Home,"Phường Thạch Thang,  Hải Châu",Bán đất,976.6,170000.0
 Lô góc 2 mặt tiền và 3 lô liền kề 562.5m2 cạnh khách sạn Như Minh thuận tiện kinh doanh,"Phường  An Hải Bắc,  Sơn Trà",Bán đất,562.5,150000.0
 Bán nhanh căn hộ HAGL giá đầu tư, Thanh Khê,Bán căn hộ chung cư,94,2050.0
 Bán lô đất mặt biển đường Võ Nguyên Giáp đối diện bãi tắm Đà Nẵng,"Phường Phước Mỹ,  Sơn Trà",Bán đất,1000,
" Cần bán lô đất 2 mặt tiền đường Võ Văn Kiệt gần đường Võ Nguyến Giáp, Đà Nẵng","Phường Phước Mỹ,  Sơn Trà",Bán đất,515.4,140000.0
 Bán lô đất 600m2 mặt tiền biển đường Võ Nguyên Giáp Đà Nẵng,"Phường Phước Mỹ,  Sơn Trà",Bán đất,600,180000000.0
" Bán đất đường gần Phạm Văn Đồng, Sơn Trà, Đà Nẵng. LH: 0935932887","Phường  An Hải Bắc,  Sơn Trà",Bán đất,88.2,8200.0
" Đất 2 mặt tiền gần đường Võ Nguyên Giáp và Trường Sa, Đà Nẵng","Phường Hòa Hải,  Ngũ Hành Sơn",Bán đất nền dự án,210,22000.0
" Tôi cần bán quán cafe đang kinh doanh ổn định rất rộng và thoáng đường Hà Huy Tập, Đà Nẵng","Phường Hòa Khê,  Thanh Khê",Bán nhà mặt phố,310,28000.0
" Căn hộ mặt biển Võ Nguyên Giáp, Đà Nẵng full nội thất, giá sốc chỉ từ 1,8 tỷ/căn. LH: 0934.75.1050", Ngũ Hành Sơn,Bán căn hộ chung cư,30,1800000.0
 Biệt thự Đảo Kim Cương - View sông 2 mặt tiền - Đẳng cấp thượng lưu - Sổ đỏ lâu dài,"Phường Hòa Quý,  Ngũ Hành Sơn","Bán nhà biệt thự, liền kề",250,31000.0
 Booking ngay biệt thự Đảo Kim Cương - Sunneva Island - Sun Group - CSBH Hấp Dẫn,"Phường Hòa Quý,  Ngũ Hành Sơn","Bán nhà biệt thự, liền kề",250,28000.0
" Duy nhất giá 4 tỷ 150 căn hộ 3PN 130m2 CC Đà Nẵng Plaza, sổ hồng lâu dài. LH: 0906475786 (gặp Miên)","Phường Thạch Thang,  Hải Châu",Bán căn hộ chung cư,130,4150.0
" Bán nhà Ông Ích Khiêm, Quận Hải Châu, 60m2 x 2 tầng, lô góc chỉ 3.5 tỷ","Phường Thanh Bình,  Hải Châu",Bán nhà riêng,60,3500.0
 Chính thức nhận đặt chỗ biệt thự hạng sang trên bờ biển đẹp nhất hành tinh tại Đà Nẵng City,"Phường Hòa Hải,  Ngũ Hành Sơn","Bán nhà biệt thự, liền kề",300,
 Bán cặp đất đường Lê Đại Hành gần Nguyễn Phước Tần,"Phường Hòa Phát,  Cẩm Lệ",Bán đất,200,14800.0
" Bán nhà mặt tiền kinh doanh trung tâm quận Hải Châu, 5x12m = 100m2, cực rẻ","Phường Hòa Cường Bắc,  Hải Châu",Bán nhà mặt phố,100,9600.0
" Bán nhà đường Đống Đa, Đà Nẵng. DT 67.8m2 x 3 tầng, ô tô vào nhà, chỉ 4.8 tỷ","Phường Thạch Thang,  Hải Châu",Bán nhà riêng,67.8,4800.0
" Đất nền Sungroup, sổ đỏ từng lô nhận ngay. Trung tâm Đà Nẵng","Phường Hòa Quý,  Ngũ Hành Sơn",Bán đất nền dự án,100,
" Chính chủ bán nhanh 102m2 gần công viên trường, bao thuế 2% - Giá chỉ 3,05 tỷ - LH: 0932.406.446", Ngũ Hành Sơn,Bán đất nền dự án,102,3050.0
 ĐẤT 2MT SƠN TRÀ ĐỐI DIỆN CÔNG VIÊN GIÁ ĐẦU TƯ,"Phường Nại Hiên Đông,  Sơn Trà",Bán đất,152,
" Duy nhất! Suất ngoại giao biệt thự đảo vip ven biển Đà Nẵng, giá gốc CĐT - Liền kề Ocean Villas","Phường Hòa Hải,  Ngũ Hành Sơn","Bán nhà biệt thự, liền kề",399,
" Chính chủ chuyển nhà cần bán gấp nhà 65m2 giá 2,65 tỷ","Phường Bình Thuận,  Hải Châu",Bán nhà riêng,65,2650.0
" Bán đất + cấp 4 (ngang 8m) kiệt ô tô đường Duy Tân, Hòa Thuận Tây, Hải Châu","Phường Hòa Thuận Tây,  Hải Châu",Bán nhà riêng,123.5,7000.0
 Bán đất MT Thủ Khoa Huân sát biển Quận Sơn Trà. DT 225m2 ngang 8.25m,"Phường An Hải Đông,  Sơn Trà",Bán đất,225,15000.0
 Biệt thự mặt sông One River - Suất ngoại giao giá tốt nhất thị trường - TT dàn trải đến 2023,"Phường Hòa Hải,  Ngũ Hành Sơn","Bán nhà biệt thự, liền kề",300,
 Bán nhà Hoà Xuân đường Tùng Lâm 10,"Phường Hòa Xuân,  Cẩm Lệ",Bán nhà riêng,100,3400.0
 Đất 110m2 hướng Đông Nam sát Shophouse Minh Mạng,"Phường Hòa Xuân,  Cẩm Lệ",Bán đất,110,3550.0
 Bán căn biệt thự DT khủng đến 234m2 mặt tiền 9m đường Bình Thái - Cẩm Lệ,"Phường Hòa Thọ Đông,  Cẩm Lệ",Bán nhà mặt phố,165,7200.0
" Bán nhanh lô B2.55 Nam Hòa Xuân hướng ĐN, giá tốt","Phường Hòa Quý,  Ngũ Hành Sơn",Bán đất,105,3500.0
" Siêu phẩm nhà 3 tầng Trương Công Hy, giá 6.38 tỷ. LH Duy Tùng 0969343088","Phường  Khuê Mỹ,  Ngũ Hành Sơn",Bán nhà mặt phố,105,6380.0
" Biệt thự Đồng Nò nhận booking, nằm trên đảo kim cương đẹp nhất Đà Nẵng - Cơ hội sở hữu giá tốt nhất","Phường Hòa Quý,  Ngũ Hành Sơn","Bán nhà biệt thự, liền kề",240,
" Bán biệt thư Euro Vilage 1 - MT Hoa Phượng 1 chính chủ, trung tâm Đà Nẵng","Phường An Hải Tây,  Sơn Trà","Bán nhà biệt thự, liền kề",250,30000.0
" Bán nhanh lô đất khu Tân Trà cách biển 100m, gần khu khách sạn Resort đẳng cấp, ngang 7,5m, giá tốt","Phường Hòa Hải,  Ngũ Hành Sơn",Bán đất,138.7,6100.0
 Siêu phẩm tháng 6 cho giới thượng lưu - tuyệt tác sở hữu lâu dài còn lại của Đà Nẵng,"Phường Hòa Quý,  Ngũ Hành Sơn","Bán nhà biệt thự, liền kề",300,
" Bán nhà 4 tầng đường Thi Sách, Hải Châu, Đà Nẵng - gần sân bay","Phường Hòa Thuận Tây,  Hải Châu",Bán nhà mặt phố,50,5900.0
 Bán đất Nam Đà Nẵng khu dân cư đông đúc chỉ 15tr/m2,"Phường Hòa Hải,  Ngũ Hành Sơn",Bán đất,100,1500.0
" Tôi muốn bán 1 căn nhà mặt tiền phố đi bộ, kiến trúc độc bản, giá bán hợp lý nhất thị trường","Phường Hòa Cường Nam,  Hải Châu",Bán nhà mặt phố,120,
 Dự án đáng sống nhất năm 2022 - vị trí độc tôn ngay sông cổ cò - siêu biệt thự 300m2 có hồ bơi,"Phường Hòa Hải,  Ngũ Hành Sơn","Bán nhà biệt thự, liền kề",300,
" 02 căn góc kề công viên nước, trung tâm phố đi bộ Regal Pavillon - giá ưu đãi - sổ công chứng ngay","Phường Hòa Cường Nam,  Hải Châu","Bán nhà biệt thự, liền kề",200,
 Đất Xanh Miền Trung tung giỏ hàng đẹp nhất view trực diện biển Mỹ Khê với quà tặng lên đến 1 tỷ,"Phường  Khuê Mỹ,  Ngũ Hành Sơn",Bán căn hộ chung cư,105,
" Duy nhất 1 căn góc 2MT nhà phố Sông Hàn, nằm trong khu phố Tây đi bộ Regal Pavillon","Phường Hòa Cường Nam,  Hải Châu","Bán nhà biệt thự, liền kề",200,
" Sunneva Island - Tuyệt tác đô thị giới thượng lưu, mảnh ghép hoàn thiện bất động sản Đà Nẵng","Phường Hòa Quý,  Ngũ Hành Sơn","Bán nhà biệt thự, liền kề",200,
 Mở bán đợt đầu dự án tuyệt phẩm đô thị Sunneva Island Đà Nẵng - Vùng đất tôn vinh vị thế chủ nhân,"Phường Hòa Quý,  Ngũ Hành Sơn","Bán nhà biệt thự, liền kề",200,
 Chúng tôi cần bán lô đất Võ Nguyên Giáp biển Mỹ Khê Đà Nẵng gần bảo tàng Hoàng Sa. LH: 0904998700, Sơn Trà,Bán đất,292,64240000.0
 Sunneva Island - Tuyệt phẩm khu đô thị đẳng cấp đáng sống đầu tiên tại Đà Nẵng sắp được ra mắt,"Phường Hòa Quý,  Ngũ Hành Sơn","Bán nhà biệt thự, liền kề",200,
 Mở bán dự án biệt thự Sunneva Island vị trí đắc địa ven sông số lượng hữu hạn tại Đà Nẵng,"Phường Hòa Quý,  Ngũ Hành Sơn","Bán nhà biệt thự, liền kề",200,
" Chúng tôi cần bán nhà 5 tầng Trần Hưng Đạo, Đà Nẵng có thang máy view sông Hàn. LH: 0904998700", Sơn Trà,Bán nhà mặt phố,100,19200.0
 Căn hộ The Sang - mặt biển Mỹ Khê tiêu chuẩn 5 sao - giá bán bất ngờ click để được tư vấn chi tiết,"Phường  Khuê Mỹ,  Ngũ Hành Sơn",Bán căn hộ chung cư,82.6,
 Mở bán siêu phẩm biệt thự đảo kim cương dự án Sun Grand City có vị trí đắc địa bậc nhất tại Đà Nẵng,"Phường Hòa Quý,  Ngũ Hành Sơn","Bán nhà biệt thự, liền kề",200,
 Chính chủ cần bán nhà mặt tiền kinh doanh Lê Văn Hiến gần Hồ Xuân Hương nhà đẹp mới xây. Giá đầu tư, Ngũ Hành Sơn,Bán nhà mặt phố,95,10500.0
 Sunneva Island - Mở bán dự án khu đô thị sang trọng đẳng cấp đầu tiên tại Đà Nẵng,"Phường Hòa Quý,  Ngũ Hành Sơn","Bán nhà biệt thự, liền kề",200,
" Nhận booking biệt thự đảo kim cương Sunneva Island vị trí kề sông, cận biển, gần sân bay","Phường Hòa Quý,  Ngũ Hành Sơn","Bán nhà biệt thự, liền kề",200,
 Chỉ từ 10 tỷ (30%) tôn vinh vị thế chủ nhân dành cho 1% giới siêu giàu - biệt thự Đảo Kim Cương,"Phường Hòa Quý,  Ngũ Hành Sơn","Bán nhà biệt thự, liền kề",240,
" Cần bán tòa nhà 5 tầng 2MT đường 2 tháng 9, Hải Châu Đà Nẵng, DT gần 620m2 - Giá tốt - 0904998700","Phường Hòa Cường Nam,  Hải Châu",Bán nhà mặt phố,620,75020000.0
 Sunneva Island - Mảnh ghép còn thiếu về quy hoạch đô thị bài bản tại thành phố đáng sống nhất VN,"Phường Hòa Quý,  Ngũ Hành Sơn","Bán nhà biệt thự, liền kề",200,
" Căn hộ view trực diện biển Mỹ Khê, sở hữu lâu dài - Giá bằng 1/2 condotel - Click để được tư vấn","Phường  Khuê Mỹ,  Ngũ Hành Sơn",Bán căn hộ chung cư,105.5,
 Bán nhiều lô đất lớn nhỏ Trần Hưng Đạo rất đẹp ven sông từ cầu Trần Thị Lý về cầu sông Hàn. Giá tốt, Sơn Trà,Bán đất,200,35000.0
 Nhận booking dự án siêu phẩm biệt thự nghỉ dưỡng đảo kim cương Sunneva Island. HTLS 0% 24 tháng,"Phường Hòa Quý,  Ngũ Hành Sơn","Bán nhà biệt thự, liền kề",200,
 Sun Olalani Đà Nẵng vị trí độc tôn + thương hiệu Sun Group,"Phường Nại Hiên Đông,  Sơn Trà","Bán nhà biệt thự, liền kề",200,
" Ra mắt dự án biệt thự đảo kim cương tại thành phố Đà Nẵng, tiềm năng khai thác vận hành cực tốt","Phường Hòa Quý,  Ngũ Hành Sơn","Bán nhà biệt thự, liền kề",200,
" Cần bán lô góc 2 MT đường Chế Viết Tấn và Lê Quang Hòa, Hòa Xuân, Đà Nẵng giá tốt xin LH 0904998700","Phường Hòa Xuân,  Cẩm Lệ",Bán đất,484,31944000.0
 Mở bán dự án Sunneva Island khu đô thị compound khép kín xây dựng đồng bộ đẳng cấp bậc nhất Đà Nẵng,"Phường Hòa Quý,  Ngũ Hành Sơn","Bán nhà biệt thự, liền kề",200,
" Bán nhà trung tâm TP 4 tầng 2MT đường Phan Châu Trinh, 12P, Hải Châu, TP Đà Nẵng - LH 0904998700","Phường  Hải Châu I,  Hải Châu",Bán nhà mặt phố,147,26000.0
 Mở bán dự án siêu phẩm biệt thự tại đảo Kim cương bao quanh bởi tuyến đường du lịch sông Cổ Cò,"Phường Hòa Quý,  Ngũ Hành Sơn","Bán nhà biệt thự, liền kề",200,
 Sunneva Island - Siêu phẩm biệt thự nghỉ dưỡng được ví như Miami Beach - Florida. HTLS 0% 24 tháng,"Phường Hòa Quý,  Ngũ Hành Sơn","Bán nhà biệt thự, liền kề",200,
 Bán lô đất biển Mỹ Khê đường Võ Nguyên Giáp - vị trí tập trung Khách sạn 5 sao đẹp nhất Đà Nẵng, Sơn Trà,Bán đất,1200,
 Sunneva Island tinh hoa kiến tạo nên kiệt tác đô thị vàng trên vùng đất Đà Nẵng. HTLS 0% 24 tháng,"Phường Hòa Quý,  Ngũ Hành Sơn","Bán nhà biệt thự, liền kề",200,
 Bán toà nhà văn phòng kết hợp căn hộ trung tâm thành phố đường Phan Châu Trinh - LH: 0904998700,"Phường Phước Ninh,  Hải Châu",Bán nhà mặt phố,115,32000.0
 Sunneva Island - Đô thị vàng hội tụ ngàn tinh hoa. Phát triển bởi CĐT top 1 thị trường Sun Group,"Phường Hòa Quý,  Ngũ Hành Sơn","Bán nhà biệt thự, liền kề",200,
" Bán ngay lô góc Võ An Ninh vị trí đẹp ngay SVĐ Hòa Xuân, DT lớn hơn 500m2 - giá rẻ đầu tư","Phường Hòa Xuân,  Cẩm Lệ",Bán đất,507,25500.0
 Dự án Sun Group Hot nhất tại Đà Nẵng - Suneva Island - BDS vị trí đảo Kim Cương trung tâm Đà Nẵng,"Phường Hòa Quý,  Ngũ Hành Sơn","Bán nhà biệt thự, liền kề",240,30000.0
 Sunneva Island - nhận booking dự án biệt thự đảo kim cương đáng sống bậc nhất thành phố Đà Nẵng,"Phường Hòa Quý,  Ngũ Hành Sơn","Bán nhà biệt thự, liền kề",200,
 Bán lô đất khu phố Tây An Thượng view công viên phù hợp xây khách sạn. Giá tốt nhất LH: 0904998700,"Phường Mỹ An,  Ngũ Hành Sơn",Bán đất,162,20500.0
 Nhận booking dự án siêu phẩm nghỉ dưỡng Sunneva Island được phát triển bởi CĐT top 1 thị trường,"Phường Hòa Quý,  Ngũ Hành Sơn","Bán nhà biệt thự, liền kề",200,
 Bán cặp đất đẹp khu An Thượng đường 7m5 gần biển xây căn hộ khách sạn rất đẹp. Giá TL thoải mái, Ngũ Hành Sơn,Bán đất,180,29500.0
 Dự án Sunneva Island vị trí đắc địa kết nối 3 điểm nổi tiếng trên con đường di sản miền Trung,"Phường Hòa Quý,  Ngũ Hành Sơn","Bán nhà biệt thự, liền kề",200,
" Bán lô đất biệt thự mặt tiền đường Bùi Tá Hán, hướng Đông Nam vị trí đẹp giá tốt nhất: 0904998700","Phường  Khuê Mỹ,  Ngũ Hành Sơn",Bán đất,250,17750000.0
" Sunneva Island - Dự án nằm trên trục du lịch đường sông huyết mạch, có nhà hàng trên sông đẳng cấp","Phường Hòa Quý,  Ngũ Hành Sơn","Bán nhà biệt thự, liền kề",200,
" Bán cặp đất đường Minh Mạng gần bãi tắm Sơn Thủy, DT 250m2, giá cực tốt LH: 0904998700","Phường  Khuê Mỹ,  Ngũ Hành Sơn",Bán đất,250,25000.0
 Chính thức mở bán dự án khu đô thị nghỉ dưỡng biệt lập được sông bao quanh giao hòa thiên nhiên,"Phường Hòa Quý,  Ngũ Hành Sơn","Bán nhà biệt thự, liền kề",200,
" Cần bán cặp đất Trần Bạch Đằng nối dài gần Võ Văn Kiệt - DT 207m2, giá cực tốt, LH: 0904998700","Phường Phước Mỹ,  Sơn Trà",Bán đất,207,35000.0
" Tôi cần bán những lô đất đẹp đường Trần Hưng Đạo nằm ven sông Hàn, Đà Nẵng thuận tiện kinh doanh", Sơn Trà,Bán đất,200,35000.0
 Bán nhà riêng 33.5m2 chính chủ tại Đà Nẵng,"Phường An Khê,  Thanh Khê",Bán nhà riêng,33.5,2000.0
" Chúng tôi cần bán lô đất 4 mặt tiền đường DT lớn Nguyễn Hữu Thọ, TP Đà Nẵng, giá rẻ LH: 0904998700","Phường Khuê Trung,  Cẩm Lệ",Bán đất,6190,340450000.0
" Cần bán biệt thự Euro Villa 1, đường Hoa Phượng 1, Sơn Trà, Đà Nẵng. LH: 0393829622", Sơn Trà,"Bán nhà biệt thự, liền kề",250,30000.0
 Bán căn biệt thự villa khu biển phố Tây An Thượng 2 mặt tiền - phù hợp nghỉ dưỡng định cư, Ngũ Hành Sơn,"Bán nhà biệt thự, liền kề",183,14500.0
 Chuyển nhượng nhanh khách sạn An Thượng 30 - Khu phố du lịch An Thượng - Giá đầu tư,"Phường Mỹ An,  Ngũ Hành Sơn",Bán nhà mặt phố,295.4,60000.0
 Cần bán một hoặc cặp đất đường Trần Hưng Đạo đối diện Monarchy - giá rẻ - LH: 0904.998.700,"Phường An Hải Tây,  Sơn Trà",Bán đất,200,35000.0
 4 lô đất 2MT đường Nghiêm Xuân Yêm và Lê Hữu Khánh - KĐT Nam Việt Á - Đà Nẵng. 0937018683,"Phường  Khuê Mỹ,  Ngũ Hành Sơn",Bán đất nền dự án,432,
 Bán đất trục Nguyễn Phước Lan gần cầu Hòa Xuân giá cực tốt khu vực sầm uất kinh doanh. 0904998700,"Phường Hòa Xuân,  Cẩm Lệ",Bán đất,200,23400000.0
 Sun Olalani khu đô thị đồng bộ đẹp nhất Đà Nẵng - nơi hội tụ tinh hoa giới thượng lưu,"Phường Nại Hiên Đông,  Sơn Trà","Bán nhà biệt thự, liền kề",240,
" Cần bán ngay căn biệt thự Khuê Mỹ Đông, Đà Nẵng để đi Pháp định cư - có hồ bơi - LH: 0904998700","Phường  Khuê Mỹ,  Ngũ Hành Sơn","Bán nhà biệt thự, liền kề",175,13900.0
" Chính chủ cần bán cặp đất Phạm Hữu Kính sát sông, giá cực kì tốt LH: 0904998700","Phường Mỹ An,  Ngũ Hành Sơn",Bán đất,200,21500.0
 Chính thức ra mắt siêu phẩm bên sông Hàn - Sun Olalani. Chỉ dành cho 1% chủ nhân vip,"Phường Nại Hiên Đông,  Sơn Trà","Bán nhà biệt thự, liền kề",350,
" Chúng tôi cần bán lô đất 2 MT Trần Hưng Đạo cực đẹp đối diện Novotel, giá tốt - LH: 0904998700","Phường  An Hải Bắc,  Sơn Trà",Bán đất,293.7,44900.0
" Bán tòa nhà KS, Spa KDL biển Mỹ Khê đường Nguyễn Văn Thoại cách biển 200m - Vị trí đẹp giá tốt", Sơn Trà,Bán nhà mặt phố,238.4,70000.0
" Bán 175m2 đất + nhà C4 (ngang 6m3) khu biển, đường Thủ Khoa Huân, Sơn Trà, Đà Nẵng","Phường An Hải Đông,  Sơn Trà",Bán nhà mặt phố,175,8700.0
 Bán đất trục Nguyễn Phước Lan gần cầu Hòa Xuân giá cực tốt khu vực sầm uất kinh doanh. 0904998700,"Phường Hòa Xuân,  Cẩm Lệ",Bán đất,100,12750.0
